product_id,manufacturer,description
490,Skivee,amet justo morbi ut odio cras mi pede malesuada in imperdiet et
491,Twimm,nisl duis ac nibh fusce lacus purus aliquet at feugiat non pretium quis lectus
492,Dabshots,porttitor lorem id ligula suspendisse ornare consequat lectus in est risus auctor sed tristique
493,Bluezoom,leo rhoncus sed vestibulum sit amet cursus id turpis integer aliquet massa id lobortis convallis tortor risus
494,Kaymbo,pede ullamcorper augue a suscipit nulla elit ac nulla sed vel enim sit amet nunc viverra dapibus nulla suscipit ligula
495,Mymm,justo aliquam quis turpis eget elit sodales scelerisque mauris sit amet eros suspendisse accumsan
496,Twitterworks,cursus vestibulum proin eu mi nulla ac enim in tempor turpis
497,Blogpad,metus sapien ut nunc vestibulum ante ipsum primis in faucibus orci luctus et ultrices posuere cubilia curae
498,Dynabox,donec pharetra magna vestibulum aliquet ultrices erat tortor sollicitudin mi sit amet lobortis sapien sapien non mi
499,Ailane,iaculis diam erat fermentum justo nec condimentum neque sapien placerat ante nulla justo aliquam quis turpis eget elit
500,Einti,dui nec nisi volutpat eleifend donec ut dolor morbi vel lectus in quam fringilla rhoncus mauris enim leo rhoncus sed
501,Meevee,cubilia curae donec pharetra magna vestibulum aliquet ultrices erat tortor sollicitudin mi sit amet lobortis sapien sapien
502,Dynabox,sagittis sapien cum sociis natoque penatibus et magnis dis parturient montes nascetur
503,Mydeo,bibendum imperdiet nullam orci pede venenatis non sodales sed tincidunt eu felis
504,Jetwire,quam fringilla rhoncus mauris enim leo rhoncus sed vestibulum sit amet cursus id turpis integer aliquet massa
505,Twitterwire,vel accumsan tellus nisi eu orci mauris lacinia sapien quis
506,Latz,duis aliquam convallis nunc proin at turpis a pede posuere
507,Rhybox,mauris morbi non lectus aliquam sit amet diam in magna bibendum
508,Dynabox,bibendum felis sed interdum venenatis turpis enim blandit mi in porttitor pede justo eu
509,Jazzy,dui vel nisl duis ac nibh fusce lacus purus aliquet
510,Jabberstorm,maecenas ut massa quis augue luctus tincidunt nulla mollis molestie lorem quisque ut erat curabitur gravida nisi at nibh in
511,Tagopia,nunc rhoncus dui vel sem sed sagittis nam congue risus semper porta volutpat quam pede lobortis ligula sit
512,Teklist,convallis nulla neque libero convallis eget eleifend luctus ultricies eu nibh quisque id justo sit
513,Viva,convallis nulla neque libero convallis eget eleifend luctus ultricies eu nibh quisque id justo sit amet sapien
514,Babbleopia,ac leo pellentesque ultrices mattis odio donec vitae nisi nam ultrices libero non mattis pulvinar nulla pede ullamcorper
515,Vipe,erat id mauris vulputate elementum nullam varius nulla facilisi cras non velit
516,Livefish,id luctus nec molestie sed justo pellentesque viverra pede ac diam cras pellentesque volutpat dui
517,Myworks,est quam pharetra magna ac consequat metus sapien ut nunc
518,Pixoboo,semper rutrum nulla nunc purus phasellus in felis donec semper sapien a libero nam dui
519,Katz,cras mi pede malesuada in imperdiet et commodo vulputate justo in blandit
520,Meetz,consectetuer adipiscing elit proin risus praesent lectus vestibulum quam sapien varius ut blandit non interdum in ante
521,Oyoba,quam a odio in hac habitasse platea dictumst maecenas ut massa quis augue luctus
522,Gevee,vestibulum sed magna at nunc commodo placerat praesent blandit nam nulla integer pede justo lacinia eget tincidunt eget tempus vel
523,Zoonoodle,justo in blandit ultrices enim lorem ipsum dolor sit amet consectetuer adipiscing elit proin interdum mauris non ligula pellentesque
524,Agimba,habitasse platea dictumst etiam faucibus cursus urna ut tellus nulla ut erat
525,Avaveo,pretium quis lectus suspendisse potenti in eleifend quam a odio in hac habitasse platea dictumst maecenas
526,Vimbo,at turpis a pede posuere nonummy integer non velit donec diam neque
527,Skyble,et ultrices posuere cubilia curae mauris viverra diam vitae quam suspendisse potenti nullam porttitor lacus at
528,Thoughtbridge,nisl nunc rhoncus dui vel sem sed sagittis nam congue risus semper porta volutpat quam pede lobortis ligula sit
529,Agimba,nullam porttitor lacus at turpis donec posuere metus vitae ipsum aliquam non mauris morbi non lectus aliquam sit amet
530,Teklist,mi sit amet lobortis sapien sapien non mi integer ac neque duis bibendum morbi
531,Skinix,viverra dapibus nulla suscipit ligula in lacus curabitur at ipsum ac tellus semper
532,Twitternation,feugiat non pretium quis lectus suspendisse potenti in eleifend quam a odio in hac habitasse platea dictumst maecenas ut massa
533,Trupe,commodo vulputate justo in blandit ultrices enim lorem ipsum dolor sit amet consectetuer adipiscing
534,Gabtune,sagittis dui vel nisl duis ac nibh fusce lacus purus aliquet at feugiat
535,Realmix,mollis molestie lorem quisque ut erat curabitur gravida nisi at nibh in hac habitasse platea dictumst aliquam
536,Layo,tincidunt nulla mollis molestie lorem quisque ut erat curabitur gravida nisi at nibh in hac habitasse platea dictumst aliquam
537,Rhynyx,vel sem sed sagittis nam congue risus semper porta volutpat quam pede lobortis
538,Kwimbee,eget nunc donec quis orci eget orci vehicula condimentum curabitur in
539,Myworks,dui nec nisi volutpat eleifend donec ut dolor morbi vel lectus in quam fringilla rhoncus
540,Oozz,natoque penatibus et magnis dis parturient montes nascetur ridiculus mus etiam vel augue vestibulum
541,Quinu,mauris non ligula pellentesque ultrices phasellus id sapien in sapien iaculis congue vivamus metus
542,Yacero,maecenas tristique est et tempus semper est quam pharetra magna ac consequat metus sapien
543,Demizz,duis at velit eu est congue elementum in hac habitasse platea dictumst morbi vestibulum velit
544,Ainyx,platea dictumst morbi vestibulum velit id pretium iaculis diam erat fermentum justo nec condimentum neque sapien placerat
545,Twinte,in faucibus orci luctus et ultrices posuere cubilia curae duis faucibus
546,Buzzdog,ante vivamus tortor duis mattis egestas metus aenean fermentum donec ut mauris eget massa
547,Eamia,pellentesque quisque porta volutpat erat quisque erat eros viverra eget
548,Cogidoo,dis parturient montes nascetur ridiculus mus vivamus vestibulum sagittis sapien cum sociis natoque penatibus et magnis dis parturient montes nascetur
549,Feedmix,eros viverra eget congue eget semper rutrum nulla nunc purus phasellus in felis
550,Bluezoom,maecenas tristique est et tempus semper est quam pharetra magna ac consequat metus sapien ut nunc vestibulum ante ipsum primis
551,Skipstorm,duis consequat dui nec nisi volutpat eleifend donec ut dolor morbi
552,Meedoo,hendrerit at vulputate vitae nisl aenean lectus pellentesque eget nunc donec quis orci
553,Jayo,ut odio cras mi pede malesuada in imperdiet et commodo vulputate justo in
554,Dabvine,cras pellentesque volutpat dui maecenas tristique est et tempus semper est quam pharetra magna ac consequat
555,Npath,lectus pellentesque eget nunc donec quis orci eget orci vehicula condimentum curabitur in libero ut massa volutpat convallis morbi
556,Kwilith,venenatis lacinia aenean sit amet justo morbi ut odio cras mi pede malesuada in imperdiet et commodo vulputate justo
557,Trudoo,ut volutpat sapien arcu sed augue aliquam erat volutpat in congue etiam justo etiam pretium iaculis justo
558,Blogpad,mauris non ligula pellentesque ultrices phasellus id sapien in sapien iaculis congue vivamus metus arcu
559,Realcube,semper porta volutpat quam pede lobortis ligula sit amet eleifend pede libero quis orci nullam molestie nibh
560,Skivee,primis in faucibus orci luctus et ultrices posuere cubilia curae donec pharetra
561,Oyondu,in lacus curabitur at ipsum ac tellus semper interdum mauris ullamcorper
562,Vinder,morbi vel lectus in quam fringilla rhoncus mauris enim leo rhoncus
563,Thoughtblab,convallis duis consequat dui nec nisi volutpat eleifend donec ut dolor morbi vel
564,Thoughtbeat,erat fermentum justo nec condimentum neque sapien placerat ante nulla justo aliquam quis turpis eget elit
565,Dazzlesphere,non mauris morbi non lectus aliquam sit amet diam in
566,Minyx,libero nam dui proin leo odio porttitor id consequat in consequat ut
567,Fivespan,turpis integer aliquet massa id lobortis convallis tortor risus dapibus augue vel
568,Quire,interdum mauris ullamcorper purus sit amet nulla quisque arcu libero rutrum
569,Kimia,donec pharetra magna vestibulum aliquet ultrices erat tortor sollicitudin mi
570,Youspan,ante ipsum primis in faucibus orci luctus et ultrices posuere cubilia curae duis faucibus accumsan
571,Babblestorm,dui vel sem sed sagittis nam congue risus semper porta volutpat quam pede lobortis
572,Voonder,quis turpis eget elit sodales scelerisque mauris sit amet eros suspendisse accumsan tortor quis turpis sed
573,Skipfire,in felis donec semper sapien a libero nam dui proin leo odio porttitor id consequat in
574,Zoomdog,erat vestibulum sed magna at nunc commodo placerat praesent blandit nam nulla integer pede justo lacinia
575,LiveZ,eget nunc donec quis orci eget orci vehicula condimentum curabitur in libero ut massa volutpat convallis morbi odio
576,Quire,maecenas pulvinar lobortis est phasellus sit amet erat nulla tempus vivamus in felis eu sapien cursus vestibulum
577,Edgeify,quam a odio in hac habitasse platea dictumst maecenas ut massa quis augue luctus tincidunt nulla mollis molestie lorem quisque
578,Janyx,vitae nisi nam ultrices libero non mattis pulvinar nulla pede ullamcorper augue
579,Midel,rhoncus mauris enim leo rhoncus sed vestibulum sit amet cursus
580,Livefish,sit amet turpis elementum ligula vehicula consequat morbi a ipsum integer a nibh in quis justo maecenas rhoncus aliquam lacus
581,Oloo,venenatis tristique fusce congue diam id ornare imperdiet sapien urna pretium nisl ut volutpat sapien
582,Zoomcast,lobortis convallis tortor risus dapibus augue vel accumsan tellus nisi eu orci
583,Zoovu,molestie hendrerit at vulputate vitae nisl aenean lectus pellentesque eget nunc
584,Zazio,ipsum primis in faucibus orci luctus et ultrices posuere cubilia curae donec pharetra magna vestibulum
585,Wordware,ante nulla justo aliquam quis turpis eget elit sodales scelerisque mauris sit amet eros
586,Thoughtmix,nullam porttitor lacus at turpis donec posuere metus vitae ipsum aliquam non mauris morbi non lectus
587,Pixonyx,ligula pellentesque ultrices phasellus id sapien in sapien iaculis congue vivamus
588,Jaloo,aliquam non mauris morbi non lectus aliquam sit amet diam in
589,Feedfish,vestibulum ac est lacinia nisi venenatis tristique fusce congue diam id
590,Quatz,dictumst maecenas ut massa quis augue luctus tincidunt nulla mollis
591,Dabtype,egestas metus aenean fermentum donec ut mauris eget massa tempor convallis nulla neque libero convallis eget eleifend luctus ultricies eu
592,Shufflebeat,tellus nisi eu orci mauris lacinia sapien quis libero nullam
593,Divanoodle,lorem integer tincidunt ante vel ipsum praesent blandit lacinia erat vestibulum sed magna
594,Wikizz,ultrices mattis odio donec vitae nisi nam ultrices libero non mattis pulvinar
595,Quinu,turpis adipiscing lorem vitae mattis nibh ligula nec sem duis aliquam convallis nunc proin
596,Wikido,ultrices libero non mattis pulvinar nulla pede ullamcorper augue a suscipit nulla elit ac
597,Twitterwire,quam pharetra magna ac consequat metus sapien ut nunc vestibulum ante ipsum primis in faucibus orci luctus et ultrices
598,Livepath,ridiculus mus vivamus vestibulum sagittis sapien cum sociis natoque penatibus et magnis
599,Fatz,in imperdiet et commodo vulputate justo in blandit ultrices enim lorem ipsum dolor sit amet consectetuer adipiscing
600,Voonder,ante vestibulum ante ipsum primis in faucibus orci luctus et ultrices
601,Eadel,mauris enim leo rhoncus sed vestibulum sit amet cursus id turpis integer aliquet massa id
602,Trunyx,et ultrices posuere cubilia curae donec pharetra magna vestibulum aliquet ultrices erat tortor sollicitudin mi sit amet lobortis sapien sapien
603,Fivechat,nibh quisque id justo sit amet sapien dignissim vestibulum vestibulum ante ipsum primis in faucibus orci luctus
604,Livefish,vestibulum sed magna at nunc commodo placerat praesent blandit nam nulla integer pede
605,Browseblab,sagittis nam congue risus semper porta volutpat quam pede lobortis ligula sit amet eleifend pede libero quis
606,Skipstorm,quam sollicitudin vitae consectetuer eget rutrum at lorem integer tincidunt ante
607,Browseblab,tempor convallis nulla neque libero convallis eget eleifend luctus ultricies eu
608,Edgepulse,quisque erat eros viverra eget congue eget semper rutrum nulla nunc purus phasellus in felis
609,Bubblebox,hac habitasse platea dictumst etiam faucibus cursus urna ut tellus nulla ut erat id mauris vulputate elementum nullam varius
610,Layo,rhoncus aliquet pulvinar sed nisl nunc rhoncus dui vel sem sed
611,Janyx,turpis donec posuere metus vitae ipsum aliquam non mauris morbi non lectus aliquam
612,Browsezoom,semper rutrum nulla nunc purus phasellus in felis donec semper sapien a libero nam dui proin leo odio porttitor
613,Vipe,suspendisse ornare consequat lectus in est risus auctor sed tristique in tempus sit amet sem fusce consequat nulla nisl
614,Skyba,quam pharetra magna ac consequat metus sapien ut nunc vestibulum ante ipsum primis in faucibus orci luctus et ultrices
615,Babblestorm,at turpis a pede posuere nonummy integer non velit donec diam neque vestibulum eget vulputate
616,Tagpad,nulla quisque arcu libero rutrum ac lobortis vel dapibus at diam nam tristique tortor
617,Photojam,dictumst aliquam augue quam sollicitudin vitae consectetuer eget rutrum at
618,Mymm,eleifend luctus ultricies eu nibh quisque id justo sit amet sapien dignissim vestibulum
619,Leenti,ac tellus semper interdum mauris ullamcorper purus sit amet nulla quisque arcu libero rutrum
620,Eare,libero non mattis pulvinar nulla pede ullamcorper augue a suscipit nulla elit ac nulla
621,Kwilith,id nulla ultrices aliquet maecenas leo odio condimentum id luctus nec molestie sed
622,Yozio,dapibus augue vel accumsan tellus nisi eu orci mauris lacinia
623,Abatz,turpis integer aliquet massa id lobortis convallis tortor risus dapibus augue vel accumsan tellus nisi eu orci mauris
624,Cogibox,aliquam augue quam sollicitudin vitae consectetuer eget rutrum at lorem integer tincidunt ante vel ipsum praesent blandit lacinia erat
625,Fiveclub,semper porta volutpat quam pede lobortis ligula sit amet eleifend pede libero quis orci nullam molestie nibh
626,Jetwire,et magnis dis parturient montes nascetur ridiculus mus vivamus vestibulum sagittis sapien cum sociis natoque penatibus
627,Brainlounge,platea dictumst aliquam augue quam sollicitudin vitae consectetuer eget rutrum at lorem integer tincidunt ante vel ipsum praesent blandit
628,Twitterworks,nulla ut erat id mauris vulputate elementum nullam varius nulla facilisi
629,Skimia,pulvinar nulla pede ullamcorper augue a suscipit nulla elit ac nulla sed vel enim sit amet
630,Thoughtworks,iaculis justo in hac habitasse platea dictumst etiam faucibus cursus urna ut tellus nulla
631,Yozio,leo rhoncus sed vestibulum sit amet cursus id turpis integer
632,Yakitri,vulputate luctus cum sociis natoque penatibus et magnis dis parturient montes nascetur ridiculus mus vivamus vestibulum sagittis
633,Geba,accumsan odio curabitur convallis duis consequat dui nec nisi volutpat eleifend donec
634,Dabshots,congue elementum in hac habitasse platea dictumst morbi vestibulum velit id pretium iaculis diam erat fermentum justo nec condimentum neque
635,Blogtag,placerat praesent blandit nam nulla integer pede justo lacinia eget tincidunt eget tempus vel pede morbi porttitor lorem id
636,Riffpedia,quis orci nullam molestie nibh in lectus pellentesque at nulla suspendisse potenti cras in
637,Trupe,faucibus orci luctus et ultrices posuere cubilia curae duis faucibus accumsan odio curabitur convallis duis consequat dui nec
638,Livefish,maecenas rhoncus aliquam lacus morbi quis tortor id nulla ultrices aliquet maecenas leo
639,Youtags,mauris lacinia sapien quis libero nullam sit amet turpis elementum ligula vehicula consequat morbi
640,Camimbo,luctus et ultrices posuere cubilia curae mauris viverra diam vitae quam suspendisse potenti nullam porttitor
641,Kazu,quam turpis adipiscing lorem vitae mattis nibh ligula nec sem duis aliquam
642,Quatz,lacinia erat vestibulum sed magna at nunc commodo placerat praesent blandit nam nulla integer pede justo lacinia eget
643,Flipopia,leo pellentesque ultrices mattis odio donec vitae nisi nam ultrices libero non
644,Meembee,eget eleifend luctus ultricies eu nibh quisque id justo sit amet sapien dignissim vestibulum
645,Eire,cum sociis natoque penatibus et magnis dis parturient montes nascetur ridiculus mus vivamus vestibulum
646,Jaxspan,tortor duis mattis egestas metus aenean fermentum donec ut mauris eget massa tempor
647,Skippad,congue risus semper porta volutpat quam pede lobortis ligula sit amet eleifend pede libero quis orci nullam molestie nibh
648,Eidel,id mauris vulputate elementum nullam varius nulla facilisi cras non velit nec nisi vulputate nonummy maecenas tincidunt lacus at velit
649,Wikido,augue vel accumsan tellus nisi eu orci mauris lacinia sapien quis libero nullam sit amet turpis elementum ligula vehicula consequat
650,Skippad,nibh in lectus pellentesque at nulla suspendisse potenti cras in purus eu magna vulputate
651,Yacero,faucibus cursus urna ut tellus nulla ut erat id mauris vulputate elementum nullam varius nulla
652,Wikizz,id turpis integer aliquet massa id lobortis convallis tortor risus dapibus augue vel accumsan tellus
653,Miboo,viverra diam vitae quam suspendisse potenti nullam porttitor lacus at turpis donec posuere metus vitae ipsum aliquam
654,Mycat,a suscipit nulla elit ac nulla sed vel enim sit amet nunc
655,Youbridge,rhoncus aliquam lacus morbi quis tortor id nulla ultrices aliquet maecenas leo odio condimentum id luctus nec
656,Centimia,magnis dis parturient montes nascetur ridiculus mus vivamus vestibulum sagittis sapien cum sociis natoque penatibus et magnis dis
657,Edgewire,non mi integer ac neque duis bibendum morbi non quam nec dui luctus rutrum nulla
658,Dazzlesphere,eu interdum eu tincidunt in leo maecenas pulvinar lobortis est phasellus sit amet erat nulla tempus vivamus
659,Wikizz,nunc proin at turpis a pede posuere nonummy integer non velit
660,Voonix,vitae nisi nam ultrices libero non mattis pulvinar nulla pede ullamcorper augue a suscipit nulla elit ac nulla sed vel
661,Kwideo,ut erat curabitur gravida nisi at nibh in hac habitasse platea dictumst aliquam augue quam sollicitudin
662,Jaxbean,ultrices posuere cubilia curae donec pharetra magna vestibulum aliquet ultrices erat tortor sollicitudin mi sit amet lobortis sapien sapien
663,Quimba,odio cras mi pede malesuada in imperdiet et commodo vulputate justo in blandit ultrices
664,Zooveo,quisque arcu libero rutrum ac lobortis vel dapibus at diam nam tristique tortor eu pede
665,Agivu,bibendum morbi non quam nec dui luctus rutrum nulla tellus in sagittis
666,Youspan,aenean auctor gravida sem praesent id massa id nisl venenatis lacinia aenean sit amet justo morbi ut odio
667,Oyope,maecenas ut massa quis augue luctus tincidunt nulla mollis molestie lorem quisque ut erat curabitur gravida nisi
668,Thoughtworks,dolor vel est donec odio justo sollicitudin ut suscipit a feugiat et
669,InnoZ,turpis integer aliquet massa id lobortis convallis tortor risus dapibus augue vel accumsan tellus nisi eu orci
670,Flashset,nonummy maecenas tincidunt lacus at velit vivamus vel nulla eget
671,Oloo,velit donec diam neque vestibulum eget vulputate ut ultrices vel augue vestibulum ante ipsum primis in faucibus orci
672,InnoZ,mauris lacinia sapien quis libero nullam sit amet turpis elementum ligula vehicula consequat morbi a ipsum integer a nibh
673,Yacero,sapien ut nunc vestibulum ante ipsum primis in faucibus orci luctus et ultrices posuere cubilia curae mauris viverra
674,Jetwire,fermentum donec ut mauris eget massa tempor convallis nulla neque libero convallis
675,DabZ,lectus in quam fringilla rhoncus mauris enim leo rhoncus sed vestibulum sit amet cursus id turpis integer aliquet massa
676,Aivee,nulla justo aliquam quis turpis eget elit sodales scelerisque mauris
677,Digitube,faucibus accumsan odio curabitur convallis duis consequat dui nec nisi volutpat eleifend donec ut dolor morbi vel lectus in quam
678,Blogpad,sem duis aliquam convallis nunc proin at turpis a pede posuere nonummy integer non velit donec diam
679,Fanoodle,aliquet at feugiat non pretium quis lectus suspendisse potenti in eleifend quam a odio in
680,Meetz,magna ac consequat metus sapien ut nunc vestibulum ante ipsum primis
681,Yozio,massa id lobortis convallis tortor risus dapibus augue vel accumsan tellus nisi eu orci mauris lacinia sapien quis libero nullam
682,Oyoyo,vestibulum sit amet cursus id turpis integer aliquet massa id lobortis convallis tortor risus dapibus augue vel
683,Gabcube,dolor morbi vel lectus in quam fringilla rhoncus mauris enim leo rhoncus
684,Wordpedia,ultrices mattis odio donec vitae nisi nam ultrices libero non mattis pulvinar nulla pede
685,Realpoint,duis bibendum morbi non quam nec dui luctus rutrum nulla tellus in sagittis dui vel nisl duis ac nibh
686,Linkbridge,ipsum primis in faucibus orci luctus et ultrices posuere cubilia curae
687,Yata,eget massa tempor convallis nulla neque libero convallis eget eleifend luctus
688,Youbridge,ac consequat metus sapien ut nunc vestibulum ante ipsum primis in faucibus
689,Lajo,erat quisque erat eros viverra eget congue eget semper rutrum nulla nunc purus phasellus in felis donec
690,Npath,tempor convallis nulla neque libero convallis eget eleifend luctus ultricies eu nibh quisque id justo sit amet sapien dignissim
691,Skinder,est congue elementum in hac habitasse platea dictumst morbi vestibulum velit id pretium iaculis diam erat fermentum justo nec
692,Leenti,sit amet diam in magna bibendum imperdiet nullam orci pede venenatis non sodales sed tincidunt eu felis fusce posuere
693,Oloo,rhoncus aliquam lacus morbi quis tortor id nulla ultrices aliquet maecenas leo odio condimentum id luctus nec molestie sed
694,Kaymbo,nunc commodo placerat praesent blandit nam nulla integer pede justo lacinia eget
695,Oozz,ipsum dolor sit amet consectetuer adipiscing elit proin interdum mauris non ligula pellentesque ultrices phasellus
696,Kazio,faucibus cursus urna ut tellus nulla ut erat id mauris vulputate elementum nullam varius
697,Browsedrive,sit amet consectetuer adipiscing elit proin risus praesent lectus vestibulum quam sapien varius ut blandit non interdum in
698,Zoomlounge,velit eu est congue elementum in hac habitasse platea dictumst morbi
699,Meetz,ultrices posuere cubilia curae duis faucibus accumsan odio curabitur convallis duis consequat
700,Realcube,eu massa donec dapibus duis at velit eu est congue elementum
701,Yakijo,suspendisse potenti cras in purus eu magna vulputate luctus cum sociis natoque penatibus et magnis dis
702,Dabtype,velit donec diam neque vestibulum eget vulputate ut ultrices vel augue vestibulum ante ipsum primis in faucibus orci
703,Twitternation,tempus semper est quam pharetra magna ac consequat metus sapien ut nunc vestibulum ante
704,Trilia,in lacus curabitur at ipsum ac tellus semper interdum mauris ullamcorper purus sit amet nulla quisque arcu libero rutrum
705,Twinte,aliquam erat volutpat in congue etiam justo etiam pretium iaculis justo in hac habitasse platea dictumst etiam faucibus
706,Thoughtworks,eget congue eget semper rutrum nulla nunc purus phasellus in
707,Einti,elit proin interdum mauris non ligula pellentesque ultrices phasellus id sapien in sapien iaculis congue vivamus metus arcu adipiscing molestie
708,Brainlounge,a ipsum integer a nibh in quis justo maecenas rhoncus aliquam lacus morbi quis tortor
709,Katz,consectetuer adipiscing elit proin risus praesent lectus vestibulum quam sapien
710,Fanoodle,amet eleifend pede libero quis orci nullam molestie nibh in lectus pellentesque at nulla
711,Browsedrive,purus sit amet nulla quisque arcu libero rutrum ac lobortis vel dapibus at diam
712,Quinu,primis in faucibus orci luctus et ultrices posuere cubilia curae mauris viverra diam vitae
713,Twitterbridge,vel lectus in quam fringilla rhoncus mauris enim leo rhoncus sed vestibulum
714,Plajo,libero nullam sit amet turpis elementum ligula vehicula consequat morbi a ipsum integer a nibh in quis justo
715,Eidel,non sodales sed tincidunt eu felis fusce posuere felis sed lacus morbi sem mauris laoreet
716,Jabbertype,dis parturient montes nascetur ridiculus mus etiam vel augue vestibulum rutrum rutrum
717,Vimbo,platea dictumst etiam faucibus cursus urna ut tellus nulla ut erat
718,Yata,vivamus in felis eu sapien cursus vestibulum proin eu mi nulla ac enim in tempor turpis nec euismod scelerisque
719,Skiptube,magnis dis parturient montes nascetur ridiculus mus etiam vel augue vestibulum rutrum rutrum neque aenean auctor gravida sem praesent
720,Rooxo,sed magna at nunc commodo placerat praesent blandit nam nulla integer pede justo lacinia
721,Vinder,maecenas tincidunt lacus at velit vivamus vel nulla eget eros elementum
722,Divape,non velit donec diam neque vestibulum eget vulputate ut ultrices vel augue vestibulum ante ipsum primis
723,Fivespan,pellentesque viverra pede ac diam cras pellentesque volutpat dui maecenas tristique est et
724,Avamm,libero ut massa volutpat convallis morbi odio odio elementum eu interdum eu tincidunt in leo
725,Feedspan,magnis dis parturient montes nascetur ridiculus mus vivamus vestibulum sagittis sapien cum sociis natoque penatibus et magnis
726,Dabfeed,ut nulla sed accumsan felis ut at dolor quis odio consequat varius integer ac leo pellentesque ultrices mattis
727,Lazzy,convallis duis consequat dui nec nisi volutpat eleifend donec ut dolor morbi vel lectus in
728,Eimbee,non velit donec diam neque vestibulum eget vulputate ut ultrices vel augue vestibulum ante ipsum primis in
