product_id,manufacturer,description
729,Realcube,nulla suspendisse potenti cras in purus eu magna vulputate luctus cum
730,Ooba,duis at velit eu est congue elementum in hac habitasse platea dictumst morbi vestibulum velit
731,Lazzy,eget eleifend luctus ultricies eu nibh quisque id justo sit amet sapien dignissim vestibulum vestibulum ante ipsum
732,Riffpedia,phasellus sit amet erat nulla tempus vivamus in felis eu sapien cursus vestibulum
733,Skidoo,augue quam sollicitudin vitae consectetuer eget rutrum at lorem integer tincidunt ante vel ipsum praesent
734,Wikizz,feugiat et eros vestibulum ac est lacinia nisi venenatis tristique fusce congue diam id ornare imperdiet
735,Myworks,at nunc commodo placerat praesent blandit nam nulla integer pede justo lacinia eget tincidunt eget tempus vel pede
736,Blogtags,curae donec pharetra magna vestibulum aliquet ultrices erat tortor sollicitudin mi sit amet
737,Skynoodle,cursus id turpis integer aliquet massa id lobortis convallis tortor
738,Mycat,volutpat sapien arcu sed augue aliquam erat volutpat in congue etiam justo etiam pretium iaculis justo in hac habitasse
739,Geba,ut tellus nulla ut erat id mauris vulputate elementum nullam varius nulla facilisi cras non velit nec nisi vulputate
740,Twitterbeat,in hac habitasse platea dictumst maecenas ut massa quis augue luctus tincidunt nulla mollis molestie lorem quisque
741,Devbug,pede ullamcorper augue a suscipit nulla elit ac nulla sed vel
742,Agivu,lectus aliquam sit amet diam in magna bibendum imperdiet nullam orci pede venenatis non
743,Topiczoom,aenean auctor gravida sem praesent id massa id nisl venenatis
744,Ntag,ut erat curabitur gravida nisi at nibh in hac habitasse platea dictumst aliquam augue quam sollicitudin vitae consectetuer eget rutrum
745,Voolith,integer non velit donec diam neque vestibulum eget vulputate ut ultrices vel augue vestibulum ante ipsum
746,Talane,eleifend pede libero quis orci nullam molestie nibh in lectus pellentesque at
747,Brightdog,dictumst aliquam augue quam sollicitudin vitae consectetuer eget rutrum at lorem integer tincidunt ante vel ipsum praesent
748,Dynazzy,donec odio justo sollicitudin ut suscipit a feugiat et eros vestibulum ac est lacinia nisi venenatis
749,Blogtag,fusce lacus purus aliquet at feugiat non pretium quis lectus suspendisse potenti in eleifend quam a odio in
750,Kwilith,habitasse platea dictumst aliquam augue quam sollicitudin vitae consectetuer eget rutrum at lorem integer tincidunt
751,Wikizz,in congue etiam justo etiam pretium iaculis justo in hac habitasse platea dictumst etiam faucibus cursus urna ut tellus nulla
752,Topiclounge,pellentesque viverra pede ac diam cras pellentesque volutpat dui maecenas tristique est et tempus semper est quam
753,Riffpedia,tellus in sagittis dui vel nisl duis ac nibh fusce lacus purus aliquet at feugiat non pretium
754,Vidoo,vitae ipsum aliquam non mauris morbi non lectus aliquam sit amet diam in magna bibendum imperdiet nullam orci pede venenatis
755,Avamba,curae nulla dapibus dolor vel est donec odio justo sollicitudin ut
756,Mybuzz,leo rhoncus sed vestibulum sit amet cursus id turpis integer aliquet massa
757,Tagpad,odio odio elementum eu interdum eu tincidunt in leo maecenas pulvinar lobortis est phasellus sit amet erat
758,Skinte,non ligula pellentesque ultrices phasellus id sapien in sapien iaculis congue vivamus metus arcu adipiscing
759,Devpoint,vestibulum eget vulputate ut ultrices vel augue vestibulum ante ipsum primis in faucibus orci luctus
760,Yacero,vitae consectetuer eget rutrum at lorem integer tincidunt ante vel ipsum praesent blandit
761,Skynoodle,libero ut massa volutpat convallis morbi odio odio elementum eu interdum eu
762,Photofeed,a suscipit nulla elit ac nulla sed vel enim sit amet nunc viverra
763,Dabvine,quisque id justo sit amet sapien dignissim vestibulum vestibulum ante ipsum primis in faucibus orci luctus et ultrices
764,Chatterbridge,elit proin interdum mauris non ligula pellentesque ultrices phasellus id sapien in
765,Bluezoom,velit nec nisi vulputate nonummy maecenas tincidunt lacus at velit vivamus vel
766,Zoonoodle,felis fusce posuere felis sed lacus morbi sem mauris laoreet ut rhoncus aliquet pulvinar sed nisl nunc rhoncus
767,Photospace,id nulla ultrices aliquet maecenas leo odio condimentum id luctus nec molestie sed justo pellentesque viverra pede ac diam cras
768,Youtags,vehicula consequat morbi a ipsum integer a nibh in quis justo maecenas rhoncus aliquam lacus morbi quis tortor id
769,Zoonder,in quis justo maecenas rhoncus aliquam lacus morbi quis tortor id nulla ultrices aliquet maecenas leo odio
770,Yodo,nam dui proin leo odio porttitor id consequat in consequat ut nulla sed accumsan felis ut at dolor quis
771,Kare,cum sociis natoque penatibus et magnis dis parturient montes nascetur
772,Skajo,amet consectetuer adipiscing elit proin risus praesent lectus vestibulum quam sapien varius ut blandit non interdum
773,Oyoba,rutrum nulla tellus in sagittis dui vel nisl duis ac nibh fusce lacus purus
774,Devbug,praesent id massa id nisl venenatis lacinia aenean sit amet
775,Ainyx,venenatis non sodales sed tincidunt eu felis fusce posuere felis sed lacus morbi sem mauris laoreet
776,Skiptube,vel sem sed sagittis nam congue risus semper porta volutpat quam
777,Mudo,eget tempus vel pede morbi porttitor lorem id ligula suspendisse ornare consequat lectus in est risus
778,Rhynyx,in faucibus orci luctus et ultrices posuere cubilia curae mauris viverra diam vitae quam suspendisse
779,Livetube,ac consequat metus sapien ut nunc vestibulum ante ipsum primis in faucibus orci luctus et ultrices
780,Feedfish,vulputate ut ultrices vel augue vestibulum ante ipsum primis in faucibus orci luctus et ultrices posuere cubilia
781,Shufflebeat,ac enim in tempor turpis nec euismod scelerisque quam turpis adipiscing lorem
782,Divape,nunc rhoncus dui vel sem sed sagittis nam congue risus semper porta volutpat quam pede lobortis
783,Youfeed,congue risus semper porta volutpat quam pede lobortis ligula sit
784,Janyx,lorem integer tincidunt ante vel ipsum praesent blandit lacinia erat vestibulum sed magna
785,Blogspan,erat id mauris vulputate elementum nullam varius nulla facilisi cras
786,Quinu,cras mi pede malesuada in imperdiet et commodo vulputate justo in blandit ultrices enim lorem ipsum dolor
787,Bluejam,pede justo lacinia eget tincidunt eget tempus vel pede morbi porttitor lorem id
788,Wordtune,at turpis donec posuere metus vitae ipsum aliquam non mauris morbi non lectus
789,Trilia,in faucibus orci luctus et ultrices posuere cubilia curae nulla dapibus dolor vel est donec odio justo
790,Aimbu,praesent blandit nam nulla integer pede justo lacinia eget tincidunt eget tempus vel pede morbi porttitor lorem id ligula suspendisse
791,Janyx,augue quam sollicitudin vitae consectetuer eget rutrum at lorem integer tincidunt ante vel ipsum
792,Mycat,consequat in consequat ut nulla sed accumsan felis ut at dolor quis odio consequat
793,Jayo,sit amet sapien dignissim vestibulum vestibulum ante ipsum primis in faucibus orci luctus et ultrices posuere cubilia curae nulla dapibus
794,Riffpedia,nulla eget eros elementum pellentesque quisque porta volutpat erat quisque erat eros viverra eget congue eget
795,Jaloo,platea dictumst aliquam augue quam sollicitudin vitae consectetuer eget rutrum at lorem integer tincidunt
796,Topdrive,et commodo vulputate justo in blandit ultrices enim lorem ipsum
797,Skidoo,praesent lectus vestibulum quam sapien varius ut blandit non interdum
798,Zava,ipsum primis in faucibus orci luctus et ultrices posuere cubilia curae duis faucibus accumsan
799,Voonyx,suspendisse potenti cras in purus eu magna vulputate luctus cum sociis natoque penatibus et magnis dis parturient montes nascetur ridiculus
800,Trunyx,dui nec nisi volutpat eleifend donec ut dolor morbi vel
801,Gabspot,felis ut at dolor quis odio consequat varius integer ac leo pellentesque
802,Brightbean,sit amet turpis elementum ligula vehicula consequat morbi a ipsum integer a nibh in quis
803,Edgeclub,amet lobortis sapien sapien non mi integer ac neque duis bibendum morbi non
804,Kwilith,pulvinar sed nisl nunc rhoncus dui vel sem sed sagittis nam
805,Kazu,morbi vel lectus in quam fringilla rhoncus mauris enim leo rhoncus sed vestibulum sit amet cursus id turpis integer aliquet
806,Riffpath,non velit nec nisi vulputate nonummy maecenas tincidunt lacus at velit vivamus vel nulla
807,Skinix,nisi vulputate nonummy maecenas tincidunt lacus at velit vivamus vel nulla eget eros elementum
808,Dabvine,tincidunt eget tempus vel pede morbi porttitor lorem id ligula suspendisse ornare consequat lectus in
809,Rhyzio,blandit mi in porttitor pede justo eu massa donec dapibus duis at velit eu est congue elementum in hac habitasse
810,Oozz,aliquam sit amet diam in magna bibendum imperdiet nullam orci pede venenatis non sodales sed
811,Dazzlesphere,et magnis dis parturient montes nascetur ridiculus mus etiam vel augue vestibulum rutrum rutrum neque aenean
812,Teklist,lacus at turpis donec posuere metus vitae ipsum aliquam non mauris morbi non lectus
813,Skyba,eros suspendisse accumsan tortor quis turpis sed ante vivamus tortor duis mattis egestas metus aenean fermentum donec ut
814,Gevee,ultrices posuere cubilia curae nulla dapibus dolor vel est donec odio
815,Thoughtstorm,nullam porttitor lacus at turpis donec posuere metus vitae ipsum aliquam non mauris morbi
816,Thoughtbeat,ornare consequat lectus in est risus auctor sed tristique in tempus sit amet
817,Eimbee,rutrum nulla nunc purus phasellus in felis donec semper sapien a libero
818,Skippad,consequat metus sapien ut nunc vestibulum ante ipsum primis in faucibus orci
819,JumpXS,lacinia aenean sit amet justo morbi ut odio cras mi pede malesuada in imperdiet et commodo vulputate justo in
820,Skyndu,justo sit amet sapien dignissim vestibulum vestibulum ante ipsum primis
821,Skippad,sit amet lobortis sapien sapien non mi integer ac neque
822,Quamba,ipsum integer a nibh in quis justo maecenas rhoncus aliquam lacus morbi
823,Podcat,eget orci vehicula condimentum curabitur in libero ut massa volutpat
824,Yabox,a ipsum integer a nibh in quis justo maecenas rhoncus aliquam lacus morbi
825,Bubblebox,donec diam neque vestibulum eget vulputate ut ultrices vel augue vestibulum ante ipsum primis
826,Oozz,eros elementum pellentesque quisque porta volutpat erat quisque erat eros viverra eget
827,Buzzbean,odio in hac habitasse platea dictumst maecenas ut massa quis augue luctus
828,Twimm,curae duis faucibus accumsan odio curabitur convallis duis consequat dui nec nisi volutpat eleifend donec ut
829,Layo,libero ut massa volutpat convallis morbi odio odio elementum eu interdum eu
830,Oyondu,condimentum curabitur in libero ut massa volutpat convallis morbi odio odio elementum eu interdum eu tincidunt in leo maecenas
831,Twiyo,ipsum dolor sit amet consectetuer adipiscing elit proin interdum mauris non ligula pellentesque ultrices
832,Skaboo,curabitur in libero ut massa volutpat convallis morbi odio odio elementum eu interdum eu tincidunt in
833,Geba,ac leo pellentesque ultrices mattis odio donec vitae nisi nam ultrices
834,Realcube,sed tristique in tempus sit amet sem fusce consequat nulla nisl
835,Twinte,in quis justo maecenas rhoncus aliquam lacus morbi quis tortor
836,Livetube,lobortis sapien sapien non mi integer ac neque duis bibendum morbi
837,Skaboo,ut dolor morbi vel lectus in quam fringilla rhoncus mauris enim leo rhoncus sed vestibulum sit
838,Eidel,tristique in tempus sit amet sem fusce consequat nulla nisl
839,Eadel,pede lobortis ligula sit amet eleifend pede libero quis orci nullam molestie
840,Jabbertype,et commodo vulputate justo in blandit ultrices enim lorem ipsum dolor
841,Trilia,blandit mi in porttitor pede justo eu massa donec dapibus duis at velit eu est congue elementum in
842,Divape,at dolor quis odio consequat varius integer ac leo pellentesque ultrices mattis odio donec vitae nisi
843,Nlounge,enim leo rhoncus sed vestibulum sit amet cursus id turpis integer
844,Oba,curae donec pharetra magna vestibulum aliquet ultrices erat tortor sollicitudin mi
845,Youopia,cubilia curae mauris viverra diam vitae quam suspendisse potenti nullam porttitor
846,Eire,morbi a ipsum integer a nibh in quis justo maecenas rhoncus
847,Feedfire,nibh fusce lacus purus aliquet at feugiat non pretium quis lectus suspendisse potenti in eleifend quam
848,Tazz,phasellus sit amet erat nulla tempus vivamus in felis eu sapien cursus vestibulum
849,Wordtune,nam nulla integer pede justo lacinia eget tincidunt eget tempus vel pede morbi porttitor lorem id ligula suspendisse
850,Myworks,vitae mattis nibh ligula nec sem duis aliquam convallis nunc proin at turpis a pede
851,Kazu,praesent id massa id nisl venenatis lacinia aenean sit amet justo
852,Pixonyx,vestibulum proin eu mi nulla ac enim in tempor turpis nec euismod scelerisque quam turpis adipiscing lorem
853,Camido,adipiscing molestie hendrerit at vulputate vitae nisl aenean lectus pellentesque eget nunc donec quis
854,Jabberbean,volutpat convallis morbi odio odio elementum eu interdum eu tincidunt in leo
855,Bubblebox,sit amet nunc viverra dapibus nulla suscipit ligula in lacus curabitur at ipsum ac tellus
856,Blognation,quam nec dui luctus rutrum nulla tellus in sagittis dui vel nisl duis ac nibh fusce lacus purus aliquet
857,Oozz,potenti cras in purus eu magna vulputate luctus cum sociis natoque penatibus et magnis dis
858,Centidel,quam pede lobortis ligula sit amet eleifend pede libero quis orci nullam molestie nibh in lectus pellentesque at nulla
859,Quinu,duis at velit eu est congue elementum in hac habitasse platea dictumst morbi vestibulum velit id pretium iaculis diam erat
860,Wikido,libero quis orci nullam molestie nibh in lectus pellentesque at nulla suspendisse potenti cras in purus eu
861,Yozio,dictumst maecenas ut massa quis augue luctus tincidunt nulla mollis molestie lorem quisque ut erat curabitur gravida nisi at nibh
862,Skyndu,aliquam quis turpis eget elit sodales scelerisque mauris sit amet eros suspendisse accumsan tortor
863,Rhynyx,dapibus nulla suscipit ligula in lacus curabitur at ipsum ac tellus semper interdum mauris ullamcorper purus
864,Skivee,ipsum primis in faucibus orci luctus et ultrices posuere cubilia curae nulla dapibus dolor vel est
865,Dabjam,vel ipsum praesent blandit lacinia erat vestibulum sed magna at nunc commodo placerat praesent blandit nam nulla integer
866,Yodoo,porta volutpat erat quisque erat eros viverra eget congue eget semper rutrum nulla nunc purus phasellus
867,Kwinu,suscipit a feugiat et eros vestibulum ac est lacinia nisi venenatis tristique fusce congue diam id ornare imperdiet sapien
868,Pixoboo,vel nulla eget eros elementum pellentesque quisque porta volutpat erat quisque erat
869,Avamm,rutrum nulla nunc purus phasellus in felis donec semper sapien a libero nam dui proin leo odio
870,Jabbersphere,morbi non quam nec dui luctus rutrum nulla tellus in sagittis dui vel nisl duis ac nibh fusce
871,Twitterworks,a feugiat et eros vestibulum ac est lacinia nisi venenatis tristique fusce
872,Nlounge,eget tempus vel pede morbi porttitor lorem id ligula suspendisse ornare
873,Demivee,lectus aliquam sit amet diam in magna bibendum imperdiet nullam orci pede venenatis non sodales sed tincidunt eu felis fusce
874,Oyope,orci eget orci vehicula condimentum curabitur in libero ut massa volutpat convallis morbi odio odio elementum eu interdum eu tincidunt
875,Dynabox,aenean sit amet justo morbi ut odio cras mi pede malesuada in
876,Thoughtmix,curabitur in libero ut massa volutpat convallis morbi odio odio elementum eu interdum eu tincidunt in leo maecenas pulvinar lobortis
877,Npath,suscipit nulla elit ac nulla sed vel enim sit amet nunc viverra dapibus nulla suscipit ligula in lacus
878,Bubbletube,eu massa donec dapibus duis at velit eu est congue elementum in
879,Feednation,nunc commodo placerat praesent blandit nam nulla integer pede justo lacinia eget tincidunt eget tempus vel pede
880,Thoughtbridge,non velit donec diam neque vestibulum eget vulputate ut ultrices vel augue
881,Dabjam,vel accumsan tellus nisi eu orci mauris lacinia sapien quis libero nullam sit
882,Twinte,ultrices mattis odio donec vitae nisi nam ultrices libero non mattis pulvinar nulla pede ullamcorper augue
883,Agimba,ultrices enim lorem ipsum dolor sit amet consectetuer adipiscing elit proin interdum mauris non ligula pellentesque ultrices phasellus
884,Wikivu,penatibus et magnis dis parturient montes nascetur ridiculus mus etiam
885,Tavu,sem fusce consequat nulla nisl nunc nisl duis bibendum felis sed interdum venenatis turpis
886,Wordpedia,curae donec pharetra magna vestibulum aliquet ultrices erat tortor sollicitudin mi sit amet lobortis sapien
887,Livepath,accumsan tortor quis turpis sed ante vivamus tortor duis mattis egestas
888,Devshare,cras non velit nec nisi vulputate nonummy maecenas tincidunt lacus at velit
889,Agimba,sit amet eros suspendisse accumsan tortor quis turpis sed ante vivamus tortor duis mattis egestas metus aenean fermentum donec ut
890,Topicblab,aliquet maecenas leo odio condimentum id luctus nec molestie sed justo
891,Avamba,nulla tempus vivamus in felis eu sapien cursus vestibulum proin eu mi nulla ac enim in
892,Rhyzio,ligula suspendisse ornare consequat lectus in est risus auctor sed tristique in tempus sit amet sem fusce consequat
893,Skyble,amet consectetuer adipiscing elit proin interdum mauris non ligula pellentesque ultrices phasellus id sapien in sapien iaculis congue vivamus metus
894,Twitterwire,nisi eu orci mauris lacinia sapien quis libero nullam sit amet turpis
895,Innotype,molestie sed justo pellentesque viverra pede ac diam cras pellentesque volutpat dui maecenas tristique
896,Realblab,sit amet sem fusce consequat nulla nisl nunc nisl duis bibendum
897,Zooxo,nunc proin at turpis a pede posuere nonummy integer non velit donec diam neque vestibulum eget
898,Voolia,molestie sed justo pellentesque viverra pede ac diam cras pellentesque volutpat dui maecenas tristique
899,Shuffletag,at lorem integer tincidunt ante vel ipsum praesent blandit lacinia erat vestibulum sed magna at
900,Tagpad,curabitur convallis duis consequat dui nec nisi volutpat eleifend donec ut dolor morbi vel lectus in
901,Mita,curabitur at ipsum ac tellus semper interdum mauris ullamcorper purus sit amet nulla
902,Ozu,justo pellentesque viverra pede ac diam cras pellentesque volutpat dui
903,Yabox,sapien cursus vestibulum proin eu mi nulla ac enim in tempor turpis nec
904,Leenti,nulla tellus in sagittis dui vel nisl duis ac nibh fusce
905,Kwimbee,molestie nibh in lectus pellentesque at nulla suspendisse potenti cras in
906,Vidoo,amet diam in magna bibendum imperdiet nullam orci pede venenatis non sodales sed tincidunt eu felis fusce posuere felis
907,Layo,mi sit amet lobortis sapien sapien non mi integer ac neque duis bibendum morbi
908,Skinte,vel lectus in quam fringilla rhoncus mauris enim leo rhoncus sed vestibulum sit amet cursus id turpis
909,Blogtag,sed interdum venenatis turpis enim blandit mi in porttitor pede justo eu massa donec dapibus duis
910,Skippad,nec condimentum neque sapien placerat ante nulla justo aliquam quis turpis eget elit sodales scelerisque
911,Topicware,ultrices posuere cubilia curae duis faucibus accumsan odio curabitur convallis duis consequat
912,Myworks,bibendum felis sed interdum venenatis turpis enim blandit mi in porttitor pede justo eu
913,Vidoo,nec nisi vulputate nonummy maecenas tincidunt lacus at velit vivamus
914,Zoonder,semper porta volutpat quam pede lobortis ligula sit amet eleifend pede libero quis orci nullam molestie nibh
915,Eimbee,consequat lectus in est risus auctor sed tristique in tempus sit amet sem fusce
916,Aimbu,ligula pellentesque ultrices phasellus id sapien in sapien iaculis congue vivamus metus arcu adipiscing
917,Brainsphere,nulla ultrices aliquet maecenas leo odio condimentum id luctus nec molestie sed justo pellentesque viverra pede
918,Pixonyx,aliquam lacus morbi quis tortor id nulla ultrices aliquet maecenas leo odio condimentum id luctus nec molestie sed justo pellentesque
919,Realbuzz,faucibus orci luctus et ultrices posuere cubilia curae mauris viverra diam
920,Kare,ac enim in tempor turpis nec euismod scelerisque quam turpis adipiscing lorem vitae mattis nibh ligula nec sem duis aliquam
921,Feedbug,vestibulum ante ipsum primis in faucibus orci luctus et ultrices posuere
922,Edgeblab,aenean sit amet justo morbi ut odio cras mi pede malesuada in imperdiet et commodo vulputate justo in
923,Centidel,felis sed lacus morbi sem mauris laoreet ut rhoncus aliquet pulvinar sed nisl nunc rhoncus dui
924,Vimbo,neque libero convallis eget eleifend luctus ultricies eu nibh quisque id justo sit amet sapien dignissim vestibulum vestibulum
925,Jabbertype,nullam sit amet turpis elementum ligula vehicula consequat morbi a ipsum integer a
926,Snaptags,libero nam dui proin leo odio porttitor id consequat in consequat ut
927,Flipstorm,lorem id ligula suspendisse ornare consequat lectus in est risus auctor
928,Zoonoodle,sollicitudin vitae consectetuer eget rutrum at lorem integer tincidunt ante vel ipsum praesent blandit lacinia erat vestibulum sed magna
929,Voonyx,ligula pellentesque ultrices phasellus id sapien in sapien iaculis congue
930,Rhynyx,vitae quam suspendisse potenti nullam porttitor lacus at turpis donec posuere metus vitae
931,Twitterlist,curae nulla dapibus dolor vel est donec odio justo sollicitudin ut suscipit a feugiat
932,Zoomlounge,cursus urna ut tellus nulla ut erat id mauris vulputate
933,Shufflester,quam fringilla rhoncus mauris enim leo rhoncus sed vestibulum sit
934,Camimbo,cum sociis natoque penatibus et magnis dis parturient montes nascetur ridiculus mus vivamus vestibulum sagittis sapien cum sociis natoque penatibus
935,Linkbridge,pede posuere nonummy integer non velit donec diam neque vestibulum
936,Demimbu,turpis donec posuere metus vitae ipsum aliquam non mauris morbi non lectus aliquam sit amet diam
937,Shuffledrive,luctus ultricies eu nibh quisque id justo sit amet sapien dignissim vestibulum vestibulum ante ipsum
938,Eidel,ultrices erat tortor sollicitudin mi sit amet lobortis sapien sapien non mi integer ac neque
939,Skivee,nulla sed vel enim sit amet nunc viverra dapibus nulla
940,Yodoo,curae duis faucibus accumsan odio curabitur convallis duis consequat dui nec nisi volutpat eleifend donec ut dolor
941,Linktype,in felis eu sapien cursus vestibulum proin eu mi nulla ac enim in tempor turpis nec
942,Kaymbo,a libero nam dui proin leo odio porttitor id consequat in consequat ut nulla
943,Riffwire,dolor morbi vel lectus in quam fringilla rhoncus mauris enim leo rhoncus sed vestibulum
944,Feedspan,in tempor turpis nec euismod scelerisque quam turpis adipiscing lorem vitae mattis nibh ligula nec sem duis aliquam convallis nunc
945,Abata,etiam faucibus cursus urna ut tellus nulla ut erat id mauris vulputate elementum nullam varius nulla facilisi cras non velit
946,Flipopia,adipiscing elit proin interdum mauris non ligula pellentesque ultrices phasellus id sapien in sapien iaculis
947,Avamm,posuere felis sed lacus morbi sem mauris laoreet ut rhoncus aliquet pulvinar
948,Livefish,sociis natoque penatibus et magnis dis parturient montes nascetur ridiculus mus etiam vel augue vestibulum rutrum rutrum neque aenean auctor
949,Npath,amet diam in magna bibendum imperdiet nullam orci pede venenatis non
950,Thoughtbeat,eget elit sodales scelerisque mauris sit amet eros suspendisse accumsan tortor quis turpis sed ante vivamus tortor duis mattis egestas
951,Jaloo,convallis tortor risus dapibus augue vel accumsan tellus nisi eu orci mauris lacinia sapien quis
952,Devcast,libero quis orci nullam molestie nibh in lectus pellentesque at nulla suspendisse potenti cras in purus eu magna vulputate luctus
953,Wikizz,sed vel enim sit amet nunc viverra dapibus nulla suscipit ligula in lacus
954,Voolia,in magna bibendum imperdiet nullam orci pede venenatis non sodales sed tincidunt eu felis fusce posuere felis sed
955,Skipstorm,quam a odio in hac habitasse platea dictumst maecenas ut massa quis augue luctus tincidunt
956,Tagfeed,est risus auctor sed tristique in tempus sit amet sem fusce consequat nulla nisl nunc nisl duis bibendum felis sed
957,Wordify,duis faucibus accumsan odio curabitur convallis duis consequat dui nec nisi volutpat eleifend donec ut dolor morbi vel lectus in
958,Oozz,orci mauris lacinia sapien quis libero nullam sit amet turpis elementum ligula vehicula
959,Meevee,porta volutpat erat quisque erat eros viverra eget congue eget semper rutrum nulla nunc purus phasellus in felis
960,Innojam,condimentum neque sapien placerat ante nulla justo aliquam quis turpis eget elit sodales scelerisque
961,Photojam,rhoncus aliquet pulvinar sed nisl nunc rhoncus dui vel sem sed sagittis
962,Zoombeat,donec ut dolor morbi vel lectus in quam fringilla rhoncus mauris enim leo rhoncus sed vestibulum sit amet
963,Oyoloo,leo rhoncus sed vestibulum sit amet cursus id turpis integer aliquet massa id lobortis convallis tortor
964,Jayo,auctor gravida sem praesent id massa id nisl venenatis lacinia
965,Divavu,vel accumsan tellus nisi eu orci mauris lacinia sapien quis libero nullam
966,Vitz,at feugiat non pretium quis lectus suspendisse potenti in eleifend quam a odio in
967,Twitterworks,augue a suscipit nulla elit ac nulla sed vel enim sit amet
968,Yabox,volutpat sapien arcu sed augue aliquam erat volutpat in congue etiam justo etiam
969,Oodoo,in purus eu magna vulputate luctus cum sociis natoque penatibus et magnis
970,Fivebridge,id nulla ultrices aliquet maecenas leo odio condimentum id luctus nec molestie sed justo pellentesque viverra pede ac diam cras
971,Divape,porttitor id consequat in consequat ut nulla sed accumsan felis ut at dolor quis odio
972,Zoomzone,lorem integer tincidunt ante vel ipsum praesent blandit lacinia erat vestibulum sed magna at nunc commodo placerat praesent blandit
973,Fivechat,lorem integer tincidunt ante vel ipsum praesent blandit lacinia erat vestibulum sed magna at nunc commodo
