product_id,manufacturer,description
246,Brainverse,pede ac diam cras pellentesque volutpat dui maecenas tristique est et tempus semper est quam pharetra magna ac consequat
247,Dynabox,urna ut tellus nulla ut erat id mauris vulputate elementum nullam
248,Wordpedia,nec euismod scelerisque quam turpis adipiscing lorem vitae mattis nibh ligula nec
249,Dablist,erat curabitur gravida nisi at nibh in hac habitasse platea
250,Avamba,dapibus dolor vel est donec odio justo sollicitudin ut suscipit a feugiat et eros vestibulum ac est
251,Wikibox,velit vivamus vel nulla eget eros elementum pellentesque quisque porta volutpat erat quisque erat eros viverra
252,Wikibox,cum sociis natoque penatibus et magnis dis parturient montes nascetur ridiculus mus etiam vel augue vestibulum rutrum
253,Skiptube,condimentum neque sapien placerat ante nulla justo aliquam quis turpis eget elit sodales scelerisque mauris sit
254,Devify,eget congue eget semper rutrum nulla nunc purus phasellus in felis donec semper sapien a libero nam dui
255,Lazz,nulla suspendisse potenti cras in purus eu magna vulputate luctus cum sociis natoque penatibus et
256,Brainverse,nulla eget eros elementum pellentesque quisque porta volutpat erat quisque erat eros viverra eget
257,Tagcat,maecenas pulvinar lobortis est phasellus sit amet erat nulla tempus vivamus in felis eu sapien cursus
258,Cogilith,ante nulla justo aliquam quis turpis eget elit sodales scelerisque mauris sit amet eros
259,Yadel,molestie hendrerit at vulputate vitae nisl aenean lectus pellentesque eget
260,Mydo,posuere metus vitae ipsum aliquam non mauris morbi non lectus aliquam sit amet diam in magna bibendum
261,Wordify,velit vivamus vel nulla eget eros elementum pellentesque quisque porta volutpat erat quisque erat eros viverra eget
262,Oyondu,ante ipsum primis in faucibus orci luctus et ultrices posuere
263,Dabshots,massa id nisl venenatis lacinia aenean sit amet justo morbi ut odio cras mi pede malesuada in
264,Skynoodle,cras in purus eu magna vulputate luctus cum sociis natoque penatibus et
265,Jabberbean,nullam molestie nibh in lectus pellentesque at nulla suspendisse potenti cras in purus eu magna vulputate luctus cum sociis
266,Ntags,eu massa donec dapibus duis at velit eu est congue
267,Divape,ante vivamus tortor duis mattis egestas metus aenean fermentum donec ut mauris
268,Skimia,hac habitasse platea dictumst etiam faucibus cursus urna ut tellus nulla ut erat
269,Dabjam,luctus rutrum nulla tellus in sagittis dui vel nisl duis ac nibh fusce lacus purus aliquet at feugiat
270,Jaxbean,sit amet erat nulla tempus vivamus in felis eu sapien cursus
271,Vinder,eros vestibulum ac est lacinia nisi venenatis tristique fusce congue diam
272,Wikibox,cras in purus eu magna vulputate luctus cum sociis natoque penatibus et magnis dis
273,Omba,aliquam non mauris morbi non lectus aliquam sit amet diam
274,Bubblemix,id nulla ultrices aliquet maecenas leo odio condimentum id luctus nec molestie sed justo pellentesque viverra pede ac
275,Buzzdog,lectus pellentesque at nulla suspendisse potenti cras in purus eu magna vulputate luctus cum sociis natoque penatibus et magnis
276,Flashpoint,nulla neque libero convallis eget eleifend luctus ultricies eu nibh quisque id justo
277,Plajo,eu mi nulla ac enim in tempor turpis nec euismod scelerisque quam turpis adipiscing lorem vitae mattis nibh ligula
278,Youspan,elit proin risus praesent lectus vestibulum quam sapien varius ut blandit non interdum in ante vestibulum ante ipsum primis in
279,Realfire,mus vivamus vestibulum sagittis sapien cum sociis natoque penatibus et magnis dis parturient montes nascetur ridiculus mus etiam
280,Wordpedia,enim sit amet nunc viverra dapibus nulla suscipit ligula in lacus curabitur
281,Blogspan,at vulputate vitae nisl aenean lectus pellentesque eget nunc donec quis orci eget orci vehicula condimentum curabitur in
282,Dazzlesphere,quam sapien varius ut blandit non interdum in ante vestibulum
283,Tagcat,pretium quis lectus suspendisse potenti in eleifend quam a odio in hac habitasse platea dictumst maecenas ut massa
284,Flashspan,semper sapien a libero nam dui proin leo odio porttitor
285,Babbleopia,lorem integer tincidunt ante vel ipsum praesent blandit lacinia erat vestibulum sed magna
286,Jabbersphere,sit amet justo morbi ut odio cras mi pede malesuada in imperdiet
287,Shufflester,dui luctus rutrum nulla tellus in sagittis dui vel nisl duis ac nibh fusce lacus purus aliquet
288,Rooxo,eget vulputate ut ultrices vel augue vestibulum ante ipsum primis in
289,Twitterbridge,magna vestibulum aliquet ultrices erat tortor sollicitudin mi sit amet lobortis sapien sapien
290,Eadel,bibendum imperdiet nullam orci pede venenatis non sodales sed tincidunt eu felis fusce posuere
291,Flashpoint,sociis natoque penatibus et magnis dis parturient montes nascetur ridiculus mus etiam vel augue vestibulum rutrum rutrum
292,Ailane,justo aliquam quis turpis eget elit sodales scelerisque mauris sit amet eros suspendisse accumsan tortor quis turpis sed ante vivamus
293,Trilia,nunc proin at turpis a pede posuere nonummy integer non velit donec diam neque vestibulum eget
294,Chatterpoint,in leo maecenas pulvinar lobortis est phasellus sit amet erat nulla tempus vivamus
295,Vinte,tempus vel pede morbi porttitor lorem id ligula suspendisse ornare consequat lectus in est risus
296,Snaptags,quisque arcu libero rutrum ac lobortis vel dapibus at diam
297,Thoughtblab,ante ipsum primis in faucibus orci luctus et ultrices posuere cubilia curae duis
298,Jetpulse,quam sollicitudin vitae consectetuer eget rutrum at lorem integer tincidunt ante
299,Tagtune,lorem vitae mattis nibh ligula nec sem duis aliquam convallis nunc proin
300,Twinder,proin interdum mauris non ligula pellentesque ultrices phasellus id sapien in sapien iaculis congue vivamus metus
301,LiveZ,ipsum aliquam non mauris morbi non lectus aliquam sit amet diam
302,Pixonyx,nec nisi vulputate nonummy maecenas tincidunt lacus at velit vivamus vel nulla eget eros elementum pellentesque quisque porta volutpat
303,Camido,sit amet lobortis sapien sapien non mi integer ac neque duis bibendum morbi non quam
304,Realfire,fusce posuere felis sed lacus morbi sem mauris laoreet ut rhoncus aliquet
305,Lazz,nisi nam ultrices libero non mattis pulvinar nulla pede ullamcorper augue a suscipit nulla elit ac
306,Trudeo,augue aliquam erat volutpat in congue etiam justo etiam pretium iaculis justo in hac habitasse
307,Ailane,orci eget orci vehicula condimentum curabitur in libero ut massa volutpat convallis morbi odio
308,Gabvine,ultrices mattis odio donec vitae nisi nam ultrices libero non mattis pulvinar nulla pede ullamcorper augue a suscipit
309,Dabshots,mauris vulputate elementum nullam varius nulla facilisi cras non velit nec nisi vulputate nonummy
310,Yodo,tristique fusce congue diam id ornare imperdiet sapien urna pretium nisl ut volutpat sapien arcu sed augue aliquam erat volutpat
311,Tagfeed,nisi vulputate nonummy maecenas tincidunt lacus at velit vivamus vel nulla eget eros elementum
312,Edgeclub,orci luctus et ultrices posuere cubilia curae nulla dapibus dolor
313,Ainyx,suspendisse potenti nullam porttitor lacus at turpis donec posuere metus vitae ipsum aliquam non mauris morbi non lectus
314,Teklist,elementum nullam varius nulla facilisi cras non velit nec nisi vulputate nonummy maecenas tincidunt lacus at velit
315,Zoomcast,sit amet cursus id turpis integer aliquet massa id lobortis convallis tortor risus dapibus augue
316,Gigaclub,posuere nonummy integer non velit donec diam neque vestibulum eget vulputate ut
317,Topicware,eget orci vehicula condimentum curabitur in libero ut massa volutpat convallis morbi odio
318,Topicstorm,lectus pellentesque at nulla suspendisse potenti cras in purus eu magna
319,Flashdog,orci luctus et ultrices posuere cubilia curae duis faucibus accumsan odio curabitur
320,Zava,duis consequat dui nec nisi volutpat eleifend donec ut dolor morbi vel lectus in quam fringilla rhoncus
321,Mynte,consequat lectus in est risus auctor sed tristique in tempus sit amet sem fusce
322,Zooveo,justo aliquam quis turpis eget elit sodales scelerisque mauris sit amet eros suspendisse accumsan tortor
323,Npath,eu sapien cursus vestibulum proin eu mi nulla ac enim in tempor turpis nec euismod scelerisque quam turpis
324,Fivespan,luctus ultricies eu nibh quisque id justo sit amet sapien dignissim vestibulum vestibulum ante ipsum
325,Oyoyo,cursus id turpis integer aliquet massa id lobortis convallis tortor risus dapibus augue vel accumsan tellus nisi eu
326,Feedmix,ac tellus semper interdum mauris ullamcorper purus sit amet nulla quisque
327,Babbleopia,diam cras pellentesque volutpat dui maecenas tristique est et tempus
328,Youspan,tortor risus dapibus augue vel accumsan tellus nisi eu orci mauris lacinia sapien quis libero nullam sit
329,Skalith,imperdiet nullam orci pede venenatis non sodales sed tincidunt eu felis fusce posuere felis sed lacus
330,Wikizz,aliquam quis turpis eget elit sodales scelerisque mauris sit amet eros suspendisse accumsan tortor quis turpis
331,Youspan,metus sapien ut nunc vestibulum ante ipsum primis in faucibus
332,Mydeo,tincidunt nulla mollis molestie lorem quisque ut erat curabitur gravida
333,Tekfly,at lorem integer tincidunt ante vel ipsum praesent blandit lacinia erat vestibulum sed magna at nunc commodo placerat praesent blandit
334,Realpoint,sed accumsan felis ut at dolor quis odio consequat varius integer ac leo pellentesque ultrices mattis odio donec vitae nisi
335,Yoveo,sollicitudin vitae consectetuer eget rutrum at lorem integer tincidunt ante vel ipsum
336,Skyndu,viverra pede ac diam cras pellentesque volutpat dui maecenas tristique
337,Zava,nec condimentum neque sapien placerat ante nulla justo aliquam quis turpis eget elit sodales
338,Rhycero,erat tortor sollicitudin mi sit amet lobortis sapien sapien non mi integer ac neque duis bibendum morbi
339,Jetpulse,nunc proin at turpis a pede posuere nonummy integer non velit
340,Tanoodle,convallis nulla neque libero convallis eget eleifend luctus ultricies eu nibh quisque id justo sit amet sapien dignissim vestibulum vestibulum
341,Youtags,eget orci vehicula condimentum curabitur in libero ut massa volutpat convallis morbi odio odio elementum eu interdum eu
342,Buzzster,sit amet sem fusce consequat nulla nisl nunc nisl duis bibendum felis
343,Tekfly,nunc purus phasellus in felis donec semper sapien a libero nam dui proin leo odio porttitor id consequat in consequat
344,Realblab,eu interdum eu tincidunt in leo maecenas pulvinar lobortis est phasellus sit amet erat nulla tempus vivamus
345,Blogpad,a libero nam dui proin leo odio porttitor id consequat in consequat ut nulla sed
346,Voonte,aliquam convallis nunc proin at turpis a pede posuere nonummy integer non velit donec diam neque vestibulum eget vulputate ut
347,Topicshots,ut tellus nulla ut erat id mauris vulputate elementum nullam varius nulla facilisi cras non velit nec nisi vulputate
348,Dynava,massa volutpat convallis morbi odio odio elementum eu interdum eu tincidunt
349,Yotz,aenean lectus pellentesque eget nunc donec quis orci eget orci vehicula condimentum curabitur in libero ut massa volutpat
350,Jaxspan,commodo vulputate justo in blandit ultrices enim lorem ipsum dolor sit amet consectetuer adipiscing
351,Zoonoodle,massa id lobortis convallis tortor risus dapibus augue vel accumsan tellus nisi
352,Rhybox,quis tortor id nulla ultrices aliquet maecenas leo odio condimentum id luctus nec molestie sed
353,Blognation,ante ipsum primis in faucibus orci luctus et ultrices posuere cubilia curae mauris viverra diam vitae quam
354,Zooxo,tincidunt ante vel ipsum praesent blandit lacinia erat vestibulum sed magna at
355,Quinu,enim in tempor turpis nec euismod scelerisque quam turpis adipiscing lorem vitae mattis nibh ligula nec sem duis
356,Thoughtsphere,at turpis donec posuere metus vitae ipsum aliquam non mauris morbi
357,Twimm,bibendum felis sed interdum venenatis turpis enim blandit mi in porttitor pede justo eu massa donec dapibus
358,Skimia,sociis natoque penatibus et magnis dis parturient montes nascetur ridiculus mus etiam vel augue vestibulum rutrum rutrum neque aenean auctor
359,Pixonyx,sit amet erat nulla tempus vivamus in felis eu sapien cursus vestibulum proin eu mi nulla ac enim in
360,Jabberstorm,nulla neque libero convallis eget eleifend luctus ultricies eu nibh quisque id justo sit amet sapien dignissim
361,Mydeo,faucibus orci luctus et ultrices posuere cubilia curae nulla dapibus dolor
362,Zooxo,ac nibh fusce lacus purus aliquet at feugiat non pretium quis
363,Blogtag,vestibulum ac est lacinia nisi venenatis tristique fusce congue diam id ornare imperdiet sapien urna
364,Nlounge,accumsan odio curabitur convallis duis consequat dui nec nisi volutpat eleifend donec
365,Photobean,integer ac neque duis bibendum morbi non quam nec dui luctus rutrum nulla tellus in sagittis dui vel
366,Babbleopia,vel nulla eget eros elementum pellentesque quisque porta volutpat erat quisque erat eros viverra eget congue eget
367,Digitube,vestibulum sit amet cursus id turpis integer aliquet massa id lobortis
368,Topicshots,dolor sit amet consectetuer adipiscing elit proin interdum mauris non ligula pellentesque ultrices phasellus id sapien in
369,Reallinks,non velit nec nisi vulputate nonummy maecenas tincidunt lacus at velit vivamus vel nulla eget eros elementum
370,Realblab,ullamcorper augue a suscipit nulla elit ac nulla sed vel enim sit
371,Zoovu,sit amet turpis elementum ligula vehicula consequat morbi a ipsum integer a
372,Ntags,non pretium quis lectus suspendisse potenti in eleifend quam a odio in hac habitasse platea
373,Eire,turpis sed ante vivamus tortor duis mattis egestas metus aenean fermentum donec ut mauris eget massa tempor
374,Skyvu,enim lorem ipsum dolor sit amet consectetuer adipiscing elit proin interdum mauris non ligula pellentesque ultrices phasellus id
375,Lajo,fermentum donec ut mauris eget massa tempor convallis nulla neque
376,Skidoo,ac leo pellentesque ultrices mattis odio donec vitae nisi nam ultrices
377,Rooxo,id mauris vulputate elementum nullam varius nulla facilisi cras non velit nec nisi vulputate nonummy maecenas tincidunt
378,Quamba,erat nulla tempus vivamus in felis eu sapien cursus vestibulum proin eu mi nulla ac
379,Mynte,vitae ipsum aliquam non mauris morbi non lectus aliquam sit amet diam
380,Thoughtstorm,malesuada in imperdiet et commodo vulputate justo in blandit ultrices enim
381,Einti,eu orci mauris lacinia sapien quis libero nullam sit amet turpis elementum ligula vehicula consequat morbi a ipsum
382,Jetwire,leo maecenas pulvinar lobortis est phasellus sit amet erat nulla
383,Trilia,ut erat curabitur gravida nisi at nibh in hac habitasse platea dictumst aliquam
384,Topicware,rhoncus sed vestibulum sit amet cursus id turpis integer aliquet massa id lobortis
385,Wikido,vestibulum vestibulum ante ipsum primis in faucibus orci luctus et ultrices posuere cubilia curae nulla dapibus dolor vel est donec
386,Trudoo,in faucibus orci luctus et ultrices posuere cubilia curae duis
387,Centimia,viverra dapibus nulla suscipit ligula in lacus curabitur at ipsum ac tellus semper interdum mauris ullamcorper purus
388,Kazio,mattis egestas metus aenean fermentum donec ut mauris eget massa tempor convallis nulla neque libero convallis
389,Jaxworks,erat curabitur gravida nisi at nibh in hac habitasse platea dictumst aliquam augue quam sollicitudin vitae
390,Viva,diam neque vestibulum eget vulputate ut ultrices vel augue vestibulum ante ipsum primis in faucibus orci luctus
391,Zoombeat,aliquet maecenas leo odio condimentum id luctus nec molestie sed justo pellentesque viverra pede ac diam cras pellentesque volutpat
392,Lajo,lectus in est risus auctor sed tristique in tempus sit amet sem fusce consequat nulla nisl
393,Leenti,odio porttitor id consequat in consequat ut nulla sed accumsan felis ut at dolor quis odio consequat varius
394,Tazz,nulla ut erat id mauris vulputate elementum nullam varius nulla facilisi cras non velit nec
395,Flashpoint,sed augue aliquam erat volutpat in congue etiam justo etiam
396,Shufflebeat,augue vel accumsan tellus nisi eu orci mauris lacinia sapien quis libero
397,Skimia,ac nibh fusce lacus purus aliquet at feugiat non pretium quis lectus suspendisse potenti in eleifend quam
398,Thoughtmix,ligula vehicula consequat morbi a ipsum integer a nibh in quis justo maecenas rhoncus aliquam lacus morbi quis tortor
399,Gabtune,est congue elementum in hac habitasse platea dictumst morbi vestibulum velit
400,Wikizz,morbi non quam nec dui luctus rutrum nulla tellus in
401,Yombu,nullam orci pede venenatis non sodales sed tincidunt eu felis fusce posuere felis sed lacus morbi sem mauris laoreet
402,Katz,lacinia nisi venenatis tristique fusce congue diam id ornare imperdiet sapien urna pretium nisl ut volutpat sapien arcu sed
403,Skipfire,tortor duis mattis egestas metus aenean fermentum donec ut mauris eget massa tempor convallis nulla neque libero convallis eget
404,Bluezoom,morbi porttitor lorem id ligula suspendisse ornare consequat lectus in est risus auctor sed tristique in tempus sit
405,Yombu,in consequat ut nulla sed accumsan felis ut at dolor quis odio consequat
406,Zooxo,aliquet ultrices erat tortor sollicitudin mi sit amet lobortis sapien
407,Thoughtbridge,pede venenatis non sodales sed tincidunt eu felis fusce posuere felis sed lacus morbi sem mauris
408,Yadel,eget nunc donec quis orci eget orci vehicula condimentum curabitur in libero ut
409,Wikivu,neque aenean auctor gravida sem praesent id massa id nisl venenatis
410,Skimia,adipiscing elit proin interdum mauris non ligula pellentesque ultrices phasellus id sapien in sapien iaculis
411,Brainbox,est lacinia nisi venenatis tristique fusce congue diam id ornare imperdiet sapien urna pretium
412,Camido,in lacus curabitur at ipsum ac tellus semper interdum mauris
413,Kaymbo,quisque porta volutpat erat quisque erat eros viverra eget congue eget semper rutrum nulla nunc purus phasellus in felis
414,Edgewire,in eleifend quam a odio in hac habitasse platea dictumst maecenas ut massa quis
415,Wikido,primis in faucibus orci luctus et ultrices posuere cubilia curae nulla dapibus dolor
416,Fatz,maecenas leo odio condimentum id luctus nec molestie sed justo pellentesque viverra pede ac diam cras pellentesque
417,Pixonyx,integer ac leo pellentesque ultrices mattis odio donec vitae nisi
418,Meeveo,in ante vestibulum ante ipsum primis in faucibus orci luctus et ultrices posuere cubilia curae duis faucibus
419,Aibox,in consequat ut nulla sed accumsan felis ut at dolor
420,Tagtune,mauris ullamcorper purus sit amet nulla quisque arcu libero rutrum ac lobortis vel dapibus at diam nam tristique tortor
421,Oozz,nisl duis bibendum felis sed interdum venenatis turpis enim blandit mi
422,Meedoo,semper interdum mauris ullamcorper purus sit amet nulla quisque arcu libero rutrum ac
423,Rhyloo,ornare imperdiet sapien urna pretium nisl ut volutpat sapien arcu
424,Photofeed,integer aliquet massa id lobortis convallis tortor risus dapibus augue vel accumsan tellus nisi eu orci mauris
425,Demizz,nibh fusce lacus purus aliquet at feugiat non pretium quis lectus suspendisse potenti in eleifend
426,Fivebridge,consequat ut nulla sed accumsan felis ut at dolor quis
427,Bluejam,ante vestibulum ante ipsum primis in faucibus orci luctus et ultrices posuere
428,Teklist,varius integer ac leo pellentesque ultrices mattis odio donec vitae nisi nam ultrices libero non mattis pulvinar nulla
429,Dynava,commodo vulputate justo in blandit ultrices enim lorem ipsum dolor sit amet consectetuer adipiscing elit proin interdum mauris non
430,Avaveo,cras non velit nec nisi vulputate nonummy maecenas tincidunt lacus at velit vivamus
431,Demimbu,at ipsum ac tellus semper interdum mauris ullamcorper purus sit amet nulla quisque arcu libero
432,Jabbersphere,morbi non lectus aliquam sit amet diam in magna bibendum imperdiet nullam orci pede
433,Jayo,consequat nulla nisl nunc nisl duis bibendum felis sed interdum venenatis turpis enim blandit
434,Trunyx,porta volutpat quam pede lobortis ligula sit amet eleifend pede libero quis orci nullam molestie nibh
435,Chatterbridge,at nunc commodo placerat praesent blandit nam nulla integer pede justo lacinia eget
436,Zoomcast,dis parturient montes nascetur ridiculus mus etiam vel augue vestibulum rutrum rutrum neque
437,Flashspan,ullamcorper purus sit amet nulla quisque arcu libero rutrum ac lobortis vel dapibus at diam nam
438,Reallinks,elit ac nulla sed vel enim sit amet nunc viverra
439,Rhyzio,tempor turpis nec euismod scelerisque quam turpis adipiscing lorem vitae mattis nibh ligula nec sem duis aliquam convallis nunc
440,Photojam,pede libero quis orci nullam molestie nibh in lectus pellentesque at nulla suspendisse potenti cras
441,Fliptune,etiam justo etiam pretium iaculis justo in hac habitasse platea dictumst etiam faucibus cursus
442,Edgepulse,amet sapien dignissim vestibulum vestibulum ante ipsum primis in faucibus orci luctus et ultrices
443,Edgepulse,congue etiam justo etiam pretium iaculis justo in hac habitasse platea dictumst
444,Meeveo,parturient montes nascetur ridiculus mus etiam vel augue vestibulum rutrum rutrum neque aenean auctor gravida sem praesent id
445,Trilia,ante vestibulum ante ipsum primis in faucibus orci luctus et ultrices posuere cubilia curae duis
446,Realblab,tempor turpis nec euismod scelerisque quam turpis adipiscing lorem vitae mattis nibh ligula nec
447,Zoonoodle,ornare imperdiet sapien urna pretium nisl ut volutpat sapien arcu sed augue aliquam erat volutpat
448,Skilith,convallis tortor risus dapibus augue vel accumsan tellus nisi eu orci mauris lacinia sapien quis libero
449,Demimbu,adipiscing lorem vitae mattis nibh ligula nec sem duis aliquam convallis nunc proin
450,Kazio,sapien arcu sed augue aliquam erat volutpat in congue etiam justo etiam pretium iaculis justo in
451,Demivee,parturient montes nascetur ridiculus mus vivamus vestibulum sagittis sapien cum sociis natoque penatibus et magnis dis parturient montes nascetur ridiculus
452,Cogilith,ut rhoncus aliquet pulvinar sed nisl nunc rhoncus dui vel sem sed
453,Zooveo,rhoncus dui vel sem sed sagittis nam congue risus semper porta volutpat quam pede lobortis ligula sit amet eleifend pede
454,Dynazzy,vehicula consequat morbi a ipsum integer a nibh in quis justo maecenas rhoncus aliquam
455,Skynoodle,venenatis tristique fusce congue diam id ornare imperdiet sapien urna pretium
456,Quatz,vestibulum proin eu mi nulla ac enim in tempor turpis nec euismod scelerisque
457,Kanoodle,donec semper sapien a libero nam dui proin leo odio porttitor
458,Jabberstorm,hac habitasse platea dictumst aliquam augue quam sollicitudin vitae consectetuer eget rutrum
459,Wikivu,rutrum at lorem integer tincidunt ante vel ipsum praesent blandit lacinia erat vestibulum sed magna at nunc commodo placerat praesent
460,Zoonoodle,adipiscing molestie hendrerit at vulputate vitae nisl aenean lectus pellentesque eget nunc donec quis
461,Aibox,cubilia curae donec pharetra magna vestibulum aliquet ultrices erat tortor sollicitudin mi sit amet lobortis sapien sapien non mi integer
462,Twitterbeat,a pede posuere nonummy integer non velit donec diam neque
463,BlogXS,id luctus nec molestie sed justo pellentesque viverra pede ac diam cras pellentesque volutpat dui maecenas tristique
464,Roodel,vivamus in felis eu sapien cursus vestibulum proin eu mi nulla ac enim in tempor turpis nec
465,Browseblab,consequat dui nec nisi volutpat eleifend donec ut dolor morbi vel lectus
466,Jamia,suspendisse potenti cras in purus eu magna vulputate luctus cum sociis natoque penatibus et magnis dis parturient
467,Photolist,donec diam neque vestibulum eget vulputate ut ultrices vel augue
468,Kimia,volutpat sapien arcu sed augue aliquam erat volutpat in congue etiam justo etiam
469,Tavu,sit amet nunc viverra dapibus nulla suscipit ligula in lacus curabitur at ipsum ac tellus semper interdum mauris
470,Wikivu,duis ac nibh fusce lacus purus aliquet at feugiat non pretium quis lectus
471,Wordtune,ut dolor morbi vel lectus in quam fringilla rhoncus mauris enim leo rhoncus sed vestibulum sit
472,Viva,eu massa donec dapibus duis at velit eu est congue elementum in hac habitasse platea dictumst morbi vestibulum
473,Cogidoo,erat fermentum justo nec condimentum neque sapien placerat ante nulla justo aliquam quis turpis eget elit
474,Digitube,bibendum morbi non quam nec dui luctus rutrum nulla tellus in sagittis dui vel
475,Wordpedia,cubilia curae mauris viverra diam vitae quam suspendisse potenti nullam
476,Jayo,magna bibendum imperdiet nullam orci pede venenatis non sodales sed tincidunt eu
477,Photospace,duis bibendum morbi non quam nec dui luctus rutrum nulla tellus in sagittis dui
478,LiveZ,curae donec pharetra magna vestibulum aliquet ultrices erat tortor sollicitudin mi sit amet lobortis sapien sapien non
479,Jatri,platea dictumst maecenas ut massa quis augue luctus tincidunt nulla mollis molestie lorem quisque ut erat
480,Vinte,eu massa donec dapibus duis at velit eu est congue elementum in hac habitasse platea dictumst
481,Teklist,a pede posuere nonummy integer non velit donec diam neque vestibulum eget vulputate ut ultrices
482,Topicware,primis in faucibus orci luctus et ultrices posuere cubilia curae nulla dapibus dolor vel est
483,Realcube,blandit mi in porttitor pede justo eu massa donec dapibus duis at velit eu est
484,Tavu,semper est quam pharetra magna ac consequat metus sapien ut nunc vestibulum ante ipsum primis in faucibus
485,Skipstorm,a libero nam dui proin leo odio porttitor id consequat in consequat ut
486,Realcube,morbi sem mauris laoreet ut rhoncus aliquet pulvinar sed nisl nunc
487,Zoonoodle,tortor risus dapibus augue vel accumsan tellus nisi eu orci mauris lacinia sapien quis libero nullam
488,Buzzdog,at dolor quis odio consequat varius integer ac leo pellentesque ultrices mattis odio donec vitae nisi
489,Trudoo,facilisi cras non velit nec nisi vulputate nonummy maecenas tincidunt lacus at velit vivamus vel nulla eget eros
