product_id,manufacturer,description
1,Voolia,varius ut blandit non interdum in ante vestibulum ante ipsum primis in faucibus
2,Gabtune,felis sed lacus morbi sem mauris laoreet ut rhoncus aliquet pulvinar sed nisl
3,Dazzlesphere,nulla integer pede justo lacinia eget tincidunt eget tempus vel pede morbi porttitor lorem id
4,Tagopia,justo pellentesque viverra pede ac diam cras pellentesque volutpat dui maecenas
5,Cogilith,quis turpis sed ante vivamus tortor duis mattis egestas metus aenean fermentum donec ut mauris
6,Teklist,porttitor lorem id ligula suspendisse ornare consequat lectus in est risus auctor sed tristique in tempus sit amet sem fusce
7,Roodel,justo sollicitudin ut suscipit a feugiat et eros vestibulum ac est lacinia nisi venenatis tristique fusce congue diam
8,Abata,molestie sed justo pellentesque viverra pede ac diam cras pellentesque volutpat
9,Geba,vulputate nonummy maecenas tincidunt lacus at velit vivamus vel nulla eget
10,Meembee,eleifend pede libero quis orci nullam molestie nibh in lectus pellentesque
11,Zazio,ante vel ipsum praesent blandit lacinia erat vestibulum sed magna
12,Centizu,blandit ultrices enim lorem ipsum dolor sit amet consectetuer adipiscing elit proin interdum mauris non ligula pellentesque
13,JumpXS,lorem ipsum dolor sit amet consectetuer adipiscing elit proin interdum mauris non ligula pellentesque
14,Dablist,etiam justo etiam pretium iaculis justo in hac habitasse platea dictumst etiam faucibus cursus urna ut tellus nulla
15,Bubblebox,interdum venenatis turpis enim blandit mi in porttitor pede justo eu massa donec dapibus duis at velit eu est
16,Digitube,amet eros suspendisse accumsan tortor quis turpis sed ante vivamus
17,Jaxspan,integer ac neque duis bibendum morbi non quam nec dui luctus rutrum nulla tellus in sagittis dui vel nisl duis
18,Buzzshare,quis turpis eget elit sodales scelerisque mauris sit amet eros suspendisse accumsan
19,Wordify,et tempus semper est quam pharetra magna ac consequat metus
20,Vinte,purus phasellus in felis donec semper sapien a libero nam dui proin leo odio
21,Skiba,in hac habitasse platea dictumst maecenas ut massa quis augue
22,Zoovu,ridiculus mus vivamus vestibulum sagittis sapien cum sociis natoque penatibus et magnis dis parturient montes nascetur ridiculus mus etiam vel
23,Dynazzy,convallis duis consequat dui nec nisi volutpat eleifend donec ut dolor morbi vel lectus
24,Brightdog,ultrices libero non mattis pulvinar nulla pede ullamcorper augue a suscipit nulla elit ac nulla
25,Devpoint,neque sapien placerat ante nulla justo aliquam quis turpis eget elit sodales scelerisque mauris
26,Fivespan,primis in faucibus orci luctus et ultrices posuere cubilia curae
27,Zoomzone,id mauris vulputate elementum nullam varius nulla facilisi cras non velit nec nisi vulputate nonummy maecenas tincidunt lacus at
28,Rhynoodle,ut rhoncus aliquet pulvinar sed nisl nunc rhoncus dui vel
29,Shuffletag,erat fermentum justo nec condimentum neque sapien placerat ante nulla justo aliquam quis turpis eget elit sodales scelerisque
30,Yacero,nisl duis bibendum felis sed interdum venenatis turpis enim blandit mi in
31,Yakijo,praesent blandit lacinia erat vestibulum sed magna at nunc commodo placerat praesent blandit
32,Yombu,elit proin risus praesent lectus vestibulum quam sapien varius ut blandit non interdum in ante vestibulum
33,Kayveo,quam turpis adipiscing lorem vitae mattis nibh ligula nec sem duis
34,Myworks,ipsum dolor sit amet consectetuer adipiscing elit proin interdum mauris non ligula pellentesque ultrices phasellus id sapien in sapien
35,Leexo,egestas metus aenean fermentum donec ut mauris eget massa tempor convallis nulla neque libero convallis eget
36,Realcube,pede libero quis orci nullam molestie nibh in lectus pellentesque at nulla suspendisse potenti cras in purus eu magna vulputate
37,Oloo,id nisl venenatis lacinia aenean sit amet justo morbi ut odio
38,Flipstorm,nulla sed vel enim sit amet nunc viverra dapibus nulla suscipit ligula in lacus curabitur
39,Plajo,venenatis tristique fusce congue diam id ornare imperdiet sapien urna pretium
40,Ozu,primis in faucibus orci luctus et ultrices posuere cubilia curae donec pharetra magna vestibulum aliquet ultrices
41,Browseblab,laoreet ut rhoncus aliquet pulvinar sed nisl nunc rhoncus dui vel sem sed sagittis nam congue risus
42,Yodo,tempus vivamus in felis eu sapien cursus vestibulum proin eu mi nulla ac
43,Skidoo,sapien a libero nam dui proin leo odio porttitor id consequat in consequat
44,Jabbertype,ipsum dolor sit amet consectetuer adipiscing elit proin interdum mauris non ligula pellentesque ultrices
45,Zoomlounge,nibh in lectus pellentesque at nulla suspendisse potenti cras in purus eu
46,Zoonoodle,nec euismod scelerisque quam turpis adipiscing lorem vitae mattis nibh ligula nec sem duis aliquam convallis
47,Ntags,nec nisi volutpat eleifend donec ut dolor morbi vel lectus in quam fringilla rhoncus mauris enim
48,Viva,tortor sollicitudin mi sit amet lobortis sapien sapien non mi integer ac neque duis bibendum morbi non quam nec dui
49,Dabtype,posuere metus vitae ipsum aliquam non mauris morbi non lectus aliquam sit amet
50,Viva,massa tempor convallis nulla neque libero convallis eget eleifend luctus ultricies eu nibh quisque id justo sit amet sapien
51,Snaptags,magna vestibulum aliquet ultrices erat tortor sollicitudin mi sit amet lobortis sapien sapien
52,Mymm,ante vestibulum ante ipsum primis in faucibus orci luctus et
53,Reallinks,nulla ultrices aliquet maecenas leo odio condimentum id luctus nec molestie sed justo pellentesque viverra pede ac diam
54,Quimba,platea dictumst etiam faucibus cursus urna ut tellus nulla ut
55,Divavu,nulla tempus vivamus in felis eu sapien cursus vestibulum proin eu
56,Skipfire,convallis morbi odio odio elementum eu interdum eu tincidunt in leo maecenas pulvinar lobortis est
57,Youspan,quisque ut erat curabitur gravida nisi at nibh in hac
58,Jetwire,praesent blandit lacinia erat vestibulum sed magna at nunc commodo placerat praesent blandit
59,Kwideo,est donec odio justo sollicitudin ut suscipit a feugiat et eros vestibulum
60,Ozu,nec nisi volutpat eleifend donec ut dolor morbi vel lectus in quam fringilla rhoncus mauris enim
61,Voonyx,erat vestibulum sed magna at nunc commodo placerat praesent blandit nam nulla integer pede justo lacinia eget tincidunt eget
62,Miboo,ut volutpat sapien arcu sed augue aliquam erat volutpat in congue etiam justo etiam pretium iaculis justo in hac habitasse
63,Bluejam,eu felis fusce posuere felis sed lacus morbi sem mauris laoreet ut rhoncus aliquet pulvinar sed nisl nunc
64,Babbleset,rhoncus sed vestibulum sit amet cursus id turpis integer aliquet massa id lobortis
65,Yamia,in blandit ultrices enim lorem ipsum dolor sit amet consectetuer
66,Zoomlounge,maecenas ut massa quis augue luctus tincidunt nulla mollis molestie lorem quisque ut
67,Gabspot,nisl duis bibendum felis sed interdum venenatis turpis enim blandit mi in porttitor pede justo
68,Shuffletag,aliquet ultrices erat tortor sollicitudin mi sit amet lobortis sapien sapien non mi integer ac neque duis bibendum morbi non
69,Devify,ac tellus semper interdum mauris ullamcorper purus sit amet nulla quisque arcu
70,Roodel,quis tortor id nulla ultrices aliquet maecenas leo odio condimentum id luctus nec molestie sed justo
71,Feedspan,ante nulla justo aliquam quis turpis eget elit sodales scelerisque mauris sit amet eros suspendisse
72,Jabbertype,sem mauris laoreet ut rhoncus aliquet pulvinar sed nisl nunc
73,Photofeed,id ligula suspendisse ornare consequat lectus in est risus auctor sed tristique in tempus sit amet sem fusce
74,Jaxnation,pede justo eu massa donec dapibus duis at velit eu est congue elementum in hac habitasse platea dictumst
75,Thoughtbridge,leo odio condimentum id luctus nec molestie sed justo pellentesque viverra pede ac diam cras pellentesque volutpat dui
76,Wikizz,at ipsum ac tellus semper interdum mauris ullamcorper purus sit amet
77,Realbridge,faucibus cursus urna ut tellus nulla ut erat id mauris vulputate elementum
78,Zooveo,justo sollicitudin ut suscipit a feugiat et eros vestibulum ac est
79,Roombo,vel accumsan tellus nisi eu orci mauris lacinia sapien quis libero nullam
80,Kare,ultrices aliquet maecenas leo odio condimentum id luctus nec molestie sed justo pellentesque viverra pede ac diam
81,Twitterwire,ipsum aliquam non mauris morbi non lectus aliquam sit amet diam in
82,Agimba,non velit nec nisi vulputate nonummy maecenas tincidunt lacus at velit vivamus vel nulla
83,Rhycero,sapien sapien non mi integer ac neque duis bibendum morbi non quam nec dui luctus rutrum nulla
84,Miboo,pretium iaculis diam erat fermentum justo nec condimentum neque sapien
85,Rhyloo,odio in hac habitasse platea dictumst maecenas ut massa quis augue luctus tincidunt nulla mollis molestie
86,Edgewire,pede venenatis non sodales sed tincidunt eu felis fusce posuere felis sed lacus morbi sem mauris laoreet
87,Yombu,eu felis fusce posuere felis sed lacus morbi sem mauris laoreet
88,Bubblebox,quam a odio in hac habitasse platea dictumst maecenas ut massa quis
89,Ozu,in blandit ultrices enim lorem ipsum dolor sit amet consectetuer adipiscing elit proin
90,Jetwire,consectetuer eget rutrum at lorem integer tincidunt ante vel ipsum praesent blandit lacinia erat
91,Dabshots,eget nunc donec quis orci eget orci vehicula condimentum curabitur in libero ut massa volutpat convallis morbi odio odio
92,Abata,imperdiet sapien urna pretium nisl ut volutpat sapien arcu sed augue aliquam erat volutpat in congue etiam justo
93,Gigashots,diam vitae quam suspendisse potenti nullam porttitor lacus at turpis donec posuere metus vitae ipsum aliquam non mauris
94,Voolith,porttitor pede justo eu massa donec dapibus duis at velit eu est congue elementum in hac
95,Pixope,nec dui luctus rutrum nulla tellus in sagittis dui vel nisl duis ac nibh fusce lacus purus aliquet at feugiat
96,Fiveclub,ullamcorper purus sit amet nulla quisque arcu libero rutrum ac lobortis vel dapibus at diam
97,Skinder,nonummy integer non velit donec diam neque vestibulum eget vulputate ut ultrices vel augue vestibulum ante ipsum
98,Agimba,duis faucibus accumsan odio curabitur convallis duis consequat dui nec
99,Youbridge,proin risus praesent lectus vestibulum quam sapien varius ut blandit non interdum in ante vestibulum ante ipsum primis
100,Meevee,fermentum donec ut mauris eget massa tempor convallis nulla neque
101,Katz,consectetuer adipiscing elit proin risus praesent lectus vestibulum quam sapien varius ut blandit non
102,Feedfire,ultrices posuere cubilia curae mauris viverra diam vitae quam suspendisse potenti nullam porttitor lacus at turpis donec posuere metus
103,Thoughtbridge,dolor sit amet consectetuer adipiscing elit proin interdum mauris non ligula pellentesque
104,Aimbu,sollicitudin mi sit amet lobortis sapien sapien non mi integer ac neque
105,Skinix,rhoncus sed vestibulum sit amet cursus id turpis integer aliquet massa id lobortis convallis tortor risus dapibus augue vel
106,Zoomdog,non velit nec nisi vulputate nonummy maecenas tincidunt lacus at velit
107,Edgetag,lobortis ligula sit amet eleifend pede libero quis orci nullam molestie nibh in lectus pellentesque at nulla
108,Bubblebox,nisl venenatis lacinia aenean sit amet justo morbi ut odio
109,Janyx,elementum ligula vehicula consequat morbi a ipsum integer a nibh in quis justo maecenas rhoncus aliquam
110,Fivespan,dictumst maecenas ut massa quis augue luctus tincidunt nulla mollis molestie lorem
111,Katz,in faucibus orci luctus et ultrices posuere cubilia curae mauris viverra diam vitae quam
112,Yodel,at turpis donec posuere metus vitae ipsum aliquam non mauris morbi non lectus aliquam
113,Skinte,ut blandit non interdum in ante vestibulum ante ipsum primis in faucibus orci
114,Jaxbean,viverra dapibus nulla suscipit ligula in lacus curabitur at ipsum ac tellus semper
115,Demizz,maecenas rhoncus aliquam lacus morbi quis tortor id nulla ultrices
116,Aibox,non pretium quis lectus suspendisse potenti in eleifend quam a odio in hac habitasse platea dictumst
117,Skyba,molestie hendrerit at vulputate vitae nisl aenean lectus pellentesque eget nunc
118,Kazu,nulla mollis molestie lorem quisque ut erat curabitur gravida nisi at nibh
119,Kimia,nibh in quis justo maecenas rhoncus aliquam lacus morbi quis tortor
120,Voolia,quis justo maecenas rhoncus aliquam lacus morbi quis tortor id nulla ultrices aliquet maecenas leo odio condimentum id
121,Skinix,mauris morbi non lectus aliquam sit amet diam in magna
122,Rhynoodle,amet nulla quisque arcu libero rutrum ac lobortis vel dapibus at diam nam tristique tortor
123,Agimba,ac nulla sed vel enim sit amet nunc viverra dapibus nulla suscipit ligula in lacus
124,Dabjam,interdum mauris ullamcorper purus sit amet nulla quisque arcu libero
125,Kamba,a pede posuere nonummy integer non velit donec diam neque
126,Voonte,nulla nunc purus phasellus in felis donec semper sapien a
127,Tazzy,vulputate vitae nisl aenean lectus pellentesque eget nunc donec quis orci
128,Kwideo,integer a nibh in quis justo maecenas rhoncus aliquam lacus morbi quis
129,Wikizz,ut rhoncus aliquet pulvinar sed nisl nunc rhoncus dui vel sem sed sagittis nam congue risus semper porta volutpat quam
130,Yombu,suscipit a feugiat et eros vestibulum ac est lacinia nisi venenatis
131,Dabjam,interdum eu tincidunt in leo maecenas pulvinar lobortis est phasellus
132,Quinu,neque sapien placerat ante nulla justo aliquam quis turpis eget elit sodales scelerisque
133,Devpoint,aliquam convallis nunc proin at turpis a pede posuere nonummy
134,Dabtype,etiam vel augue vestibulum rutrum rutrum neque aenean auctor gravida sem praesent id massa id nisl venenatis lacinia
135,Jatri,quis orci nullam molestie nibh in lectus pellentesque at nulla suspendisse potenti cras in purus
136,Flipstorm,duis at velit eu est congue elementum in hac habitasse platea dictumst
137,Dabshots,metus arcu adipiscing molestie hendrerit at vulputate vitae nisl aenean lectus pellentesque eget nunc donec
138,Jaloo,luctus et ultrices posuere cubilia curae duis faucibus accumsan odio curabitur convallis duis consequat dui nec nisi volutpat eleifend donec
139,Nlounge,massa volutpat convallis morbi odio odio elementum eu interdum eu tincidunt in leo maecenas pulvinar lobortis est
140,Edgeify,erat quisque erat eros viverra eget congue eget semper rutrum nulla
141,Thoughtblab,pellentesque at nulla suspendisse potenti cras in purus eu magna vulputate luctus cum sociis natoque penatibus
142,Thoughtbridge,mauris lacinia sapien quis libero nullam sit amet turpis elementum ligula vehicula consequat morbi a ipsum integer
143,Jabberbean,duis consequat dui nec nisi volutpat eleifend donec ut dolor morbi vel lectus in
144,Jatri,dui nec nisi volutpat eleifend donec ut dolor morbi vel lectus in quam fringilla rhoncus mauris enim leo
145,Yamia,elementum nullam varius nulla facilisi cras non velit nec nisi vulputate nonummy maecenas tincidunt lacus
146,Mydo,integer ac leo pellentesque ultrices mattis odio donec vitae nisi nam ultrices libero non
147,Aibox,tellus nulla ut erat id mauris vulputate elementum nullam varius nulla
148,Skimia,eros suspendisse accumsan tortor quis turpis sed ante vivamus tortor duis mattis egestas metus
149,Yodel,ut rhoncus aliquet pulvinar sed nisl nunc rhoncus dui vel sem sed sagittis nam congue risus semper porta volutpat quam
150,Linktype,pede malesuada in imperdiet et commodo vulputate justo in blandit ultrices enim lorem ipsum dolor sit amet consectetuer adipiscing
151,Babbleset,bibendum felis sed interdum venenatis turpis enim blandit mi in porttitor pede justo eu massa donec dapibus duis at velit
152,Skibox,at ipsum ac tellus semper interdum mauris ullamcorper purus sit amet nulla quisque arcu libero rutrum ac lobortis vel dapibus
153,Zooxo,sed sagittis nam congue risus semper porta volutpat quam pede lobortis ligula sit amet eleifend pede libero
154,Skivee,nec sem duis aliquam convallis nunc proin at turpis a
155,Zoonder,tincidunt ante vel ipsum praesent blandit lacinia erat vestibulum sed magna at nunc commodo placerat
156,Voonte,nibh in hac habitasse platea dictumst aliquam augue quam sollicitudin vitae consectetuer eget rutrum at lorem integer
157,Talane,nisl nunc nisl duis bibendum felis sed interdum venenatis turpis enim blandit mi in porttitor pede justo eu massa
158,Feedspan,tristique est et tempus semper est quam pharetra magna ac consequat metus
159,Fivebridge,ut ultrices vel augue vestibulum ante ipsum primis in faucibus orci luctus et ultrices posuere
160,Twinder,ac neque duis bibendum morbi non quam nec dui luctus
161,Kamba,in congue etiam justo etiam pretium iaculis justo in hac habitasse platea dictumst etiam
162,Twimbo,sagittis sapien cum sociis natoque penatibus et magnis dis parturient montes nascetur ridiculus mus etiam vel augue
163,Mydo,aliquam erat volutpat in congue etiam justo etiam pretium iaculis justo in hac habitasse platea
164,Demivee,id turpis integer aliquet massa id lobortis convallis tortor risus dapibus augue vel accumsan tellus nisi
165,Quatz,lacinia erat vestibulum sed magna at nunc commodo placerat praesent blandit nam nulla integer pede justo lacinia eget tincidunt eget
166,Riffpath,vestibulum sagittis sapien cum sociis natoque penatibus et magnis dis parturient montes nascetur ridiculus mus etiam vel augue vestibulum
167,Riffpath,tristique in tempus sit amet sem fusce consequat nulla nisl nunc nisl
168,Reallinks,in faucibus orci luctus et ultrices posuere cubilia curae mauris viverra diam vitae quam suspendisse potenti nullam porttitor lacus
169,Yoveo,semper rutrum nulla nunc purus phasellus in felis donec semper sapien a libero nam dui proin leo
170,Zooveo,turpis nec euismod scelerisque quam turpis adipiscing lorem vitae mattis nibh ligula nec sem duis
171,Skidoo,metus aenean fermentum donec ut mauris eget massa tempor convallis
172,Rhynyx,et ultrices posuere cubilia curae mauris viverra diam vitae quam suspendisse potenti nullam porttitor
173,Voomm,metus sapien ut nunc vestibulum ante ipsum primis in faucibus orci luctus et
174,Riffpath,nisi vulputate nonummy maecenas tincidunt lacus at velit vivamus vel nulla eget eros
175,Yakidoo,morbi vestibulum velit id pretium iaculis diam erat fermentum justo nec condimentum neque sapien placerat ante nulla justo aliquam quis
176,Twitterbridge,id luctus nec molestie sed justo pellentesque viverra pede ac diam cras pellentesque volutpat dui maecenas tristique est et tempus
177,Aimbo,consectetuer adipiscing elit proin risus praesent lectus vestibulum quam sapien varius ut blandit non interdum in
178,Yacero,volutpat erat quisque erat eros viverra eget congue eget semper rutrum nulla nunc
179,Youfeed,ac consequat metus sapien ut nunc vestibulum ante ipsum primis in faucibus orci luctus et ultrices posuere cubilia curae mauris
180,Quatz,semper porta volutpat quam pede lobortis ligula sit amet eleifend pede libero quis orci nullam
181,Brainverse,nisi eu orci mauris lacinia sapien quis libero nullam sit amet turpis elementum ligula vehicula
182,Snaptags,consequat ut nulla sed accumsan felis ut at dolor quis odio consequat varius integer ac leo pellentesque ultrices mattis odio
183,Gevee,justo nec condimentum neque sapien placerat ante nulla justo aliquam quis turpis eget elit sodales scelerisque mauris sit amet eros
184,Dabtype,ultrices enim lorem ipsum dolor sit amet consectetuer adipiscing elit proin interdum mauris non ligula pellentesque ultrices phasellus id
185,Meeveo,augue vestibulum rutrum rutrum neque aenean auctor gravida sem praesent id massa id nisl venenatis lacinia aenean sit
186,Youfeed,mauris vulputate elementum nullam varius nulla facilisi cras non velit nec
187,Myworks,vestibulum velit id pretium iaculis diam erat fermentum justo nec condimentum neque sapien placerat ante nulla justo aliquam
188,Jaxnation,at vulputate vitae nisl aenean lectus pellentesque eget nunc donec quis orci eget orci vehicula condimentum curabitur in
189,Devshare,orci eget orci vehicula condimentum curabitur in libero ut massa volutpat convallis
190,Dablist,convallis nunc proin at turpis a pede posuere nonummy integer non velit
191,Muxo,proin leo odio porttitor id consequat in consequat ut nulla sed accumsan felis ut at
192,Jaloo,cubilia curae mauris viverra diam vitae quam suspendisse potenti nullam porttitor lacus at
193,Tagopia,morbi odio odio elementum eu interdum eu tincidunt in leo maecenas pulvinar lobortis est phasellus sit amet erat nulla
194,Mydeo,iaculis diam erat fermentum justo nec condimentum neque sapien placerat ante nulla justo aliquam quis turpis eget elit sodales scelerisque
195,Youfeed,leo odio condimentum id luctus nec molestie sed justo pellentesque viverra pede ac diam cras pellentesque volutpat
196,Blogtags,penatibus et magnis dis parturient montes nascetur ridiculus mus etiam vel augue vestibulum rutrum rutrum neque aenean auctor gravida sem
197,Realmix,imperdiet sapien urna pretium nisl ut volutpat sapien arcu sed
198,Oyoloo,nibh fusce lacus purus aliquet at feugiat non pretium quis lectus
199,Kwideo,libero convallis eget eleifend luctus ultricies eu nibh quisque id justo sit amet
200,Photojam,cum sociis natoque penatibus et magnis dis parturient montes nascetur
201,Pixoboo,aliquet pulvinar sed nisl nunc rhoncus dui vel sem sed sagittis nam congue risus semper
202,Realblab,ultrices vel augue vestibulum ante ipsum primis in faucibus orci luctus et ultrices posuere cubilia curae donec pharetra
203,Kayveo,sem sed sagittis nam congue risus semper porta volutpat quam pede lobortis ligula
204,Teklist,non sodales sed tincidunt eu felis fusce posuere felis sed lacus morbi sem
205,Twiyo,aenean auctor gravida sem praesent id massa id nisl venenatis lacinia aenean sit
206,Thoughtbridge,vivamus in felis eu sapien cursus vestibulum proin eu mi nulla ac enim in tempor turpis nec euismod scelerisque
207,Dabfeed,ipsum primis in faucibus orci luctus et ultrices posuere cubilia curae mauris
208,Yozio,vestibulum ante ipsum primis in faucibus orci luctus et ultrices posuere cubilia curae mauris viverra diam
209,Twitterbridge,dui maecenas tristique est et tempus semper est quam pharetra magna ac consequat metus sapien ut nunc vestibulum ante ipsum
210,Skyba,ornare imperdiet sapien urna pretium nisl ut volutpat sapien arcu sed augue
211,Youbridge,platea dictumst etiam faucibus cursus urna ut tellus nulla ut
212,Abatz,curabitur gravida nisi at nibh in hac habitasse platea dictumst aliquam augue quam sollicitudin vitae consectetuer eget
213,Voonyx,id nulla ultrices aliquet maecenas leo odio condimentum id luctus nec molestie sed justo pellentesque viverra pede ac
214,Ntags,sed tincidunt eu felis fusce posuere felis sed lacus morbi sem mauris laoreet ut rhoncus aliquet
215,Kazio,ac consequat metus sapien ut nunc vestibulum ante ipsum primis in faucibus orci luctus et ultrices posuere
216,Innojam,orci luctus et ultrices posuere cubilia curae mauris viverra diam vitae
217,Izio,ut blandit non interdum in ante vestibulum ante ipsum primis in faucibus orci
218,Wikido,in faucibus orci luctus et ultrices posuere cubilia curae nulla dapibus dolor
219,Dynava,id lobortis convallis tortor risus dapibus augue vel accumsan tellus nisi eu orci
220,Wikido,aliquam quis turpis eget elit sodales scelerisque mauris sit amet eros suspendisse accumsan tortor quis
221,Katz,et ultrices posuere cubilia curae duis faucibus accumsan odio curabitur convallis duis consequat dui nec nisi
222,Dabshots,vivamus metus arcu adipiscing molestie hendrerit at vulputate vitae nisl aenean lectus pellentesque eget nunc donec
223,Eayo,amet lobortis sapien sapien non mi integer ac neque duis bibendum morbi non quam nec dui luctus rutrum nulla tellus
224,Thoughtmix,ac nulla sed vel enim sit amet nunc viverra dapibus nulla
225,Wikizz,elementum eu interdum eu tincidunt in leo maecenas pulvinar lobortis
226,Roodel,neque vestibulum eget vulputate ut ultrices vel augue vestibulum ante
227,Trilith,lacus morbi quis tortor id nulla ultrices aliquet maecenas leo odio condimentum id luctus nec
228,Divavu,consequat nulla nisl nunc nisl duis bibendum felis sed interdum venenatis turpis enim blandit mi in porttitor pede justo eu
229,Jazzy,cursus vestibulum proin eu mi nulla ac enim in tempor turpis nec euismod scelerisque quam turpis adipiscing lorem vitae
230,Yadel,sed justo pellentesque viverra pede ac diam cras pellentesque volutpat dui maecenas tristique est et
231,Riffwire,orci luctus et ultrices posuere cubilia curae duis faucibus accumsan odio curabitur convallis duis consequat dui
232,Linklinks,curabitur convallis duis consequat dui nec nisi volutpat eleifend donec
233,Oodoo,felis ut at dolor quis odio consequat varius integer ac
234,Vinder,adipiscing lorem vitae mattis nibh ligula nec sem duis aliquam convallis
235,Feednation,quam nec dui luctus rutrum nulla tellus in sagittis dui vel
236,Kwinu,lobortis sapien sapien non mi integer ac neque duis bibendum morbi non quam nec dui
237,Tavu,cursus vestibulum proin eu mi nulla ac enim in tempor turpis nec euismod scelerisque quam turpis adipiscing lorem vitae
238,Demimbu,ante ipsum primis in faucibus orci luctus et ultrices posuere cubilia curae duis faucibus accumsan odio curabitur convallis duis
239,Eare,odio consequat varius integer ac leo pellentesque ultrices mattis odio donec vitae nisi nam ultrices libero non mattis pulvinar nulla
240,Realmix,vestibulum ante ipsum primis in faucibus orci luctus et ultrices
241,Brainbox,sapien a libero nam dui proin leo odio porttitor id consequat in consequat ut
242,Avavee,diam erat fermentum justo nec condimentum neque sapien placerat ante nulla justo aliquam quis turpis eget elit sodales scelerisque
243,Jabberstorm,venenatis turpis enim blandit mi in porttitor pede justo eu massa donec dapibus duis at velit eu
244,Fliptune,consequat dui nec nisi volutpat eleifend donec ut dolor morbi vel lectus in
245,Oyondu,cubilia curae duis faucibus accumsan odio curabitur convallis duis consequat dui nec nisi volutpat eleifend donec ut dolor
